2026-05-28 03:01:44.426832 IP 10.0.0.3.33008 > 10.0.0.2.5001: Flags [S], seq 2970252807, win 64240, options [mss 1460,sackOK,TS val 3617347823 ecr 0,nop,wscale 7], length 0
2026-05-28 03:01:44.426850 IP 10.0.0.2.5001 > 10.0.0.3.33008: Flags [S.], seq 1384402762, ack 2970252808, win 65160, options [mss 1460,sackOK,TS val 1338686418 ecr 3617347823,nop,wscale 7], length 0
2026-05-28 03:01:44.439617 IP 10.0.0.3.33008 > 10.0.0.2.5001: Flags [.], ack 1, win 502, options [nop,nop,TS val 3617347834 ecr 1338686418], length 0
2026-05-28 03:01:44.439648 IP 10.0.0.3.33008 > 10.0.0.2.5001: Flags [P.], seq 1:31, ack 1, win 502, options [nop,nop,TS val 3617347834 ecr 1338686418], length 30
2026-05-28 03:01:44.439656 IP 10.0.0.2.5001 > 10.0.0.3.33008: Flags [.], ack 31, win 509, options [nop,nop,TS val 1338686431 ecr 3617347834], length 0
2026-05-28 03:01:44.439658 IP 10.0.0.3.33008 > 10.0.0.2.5001: Flags [.], seq 31:1479, ack 1, win 502, options [nop,nop,TS val 3617347834 ecr 1338686418], length 1448
2026-05-28 03:01:44.439660 IP 10.0.0.2.5001 > 10.0.0.3.33008: Flags [.], ack 1479, win 532, options [nop,nop,TS val 1338686431 ecr 3617347834], length 0
2026-05-28 03:01:44.439660 IP 10.0.0.3.33008 > 10.0.0.2.5001: Flags [.], seq 1479:2927, ack 1, win 502, options [nop,nop,TS val 3617347834 ecr 1338686418], length 1448
2026-05-28 03:01:44.439662 IP 10.0.0.2.5001 > 10.0.0.3.33008: Flags [.], ack 2927, win 555, options [nop,nop,TS val 1338686431 ecr 3617347834], length 0
2026-05-28 03:01:44.439662 IP 10.0.0.3.33008 > 10.0.0.2.5001: Flags [.], seq 2927:4375, ack 1, win 502, options [nop,nop,TS val 3617347834 ecr 1338686418], length 1448
2026-05-28 03:01:44.439662 IP 10.0.0.2.5001 > 10.0.0.3.33008: Flags [.], ack 4375, win 577, options [nop,nop,TS val 1338686431 ecr 3617347834], length 0
2026-05-28 03:01:44.439663 IP 10.0.0.3.33008 > 10.0.0.2.5001: Flags [.], seq 4375:5823, ack 1, win 502, options [nop,nop,TS val 3617347834 ecr 1338686418], length 1448
2026-05-28 03:01:44.439664 IP 10.0.0.2.5001 > 10.0.0.3.33008: Flags [.], ack 5823, win 583, options [nop,nop,TS val 1338686431 ecr 3617347834], length 0
2026-05-28 03:01:44.439664 IP 10.0.0.3.33008 > 10.0.0.2.5001: Flags [.], seq 5823:7271, ack 1, win 502, options [nop,nop,TS val 3617347834 ecr 1338686418], length 1448
2026-05-28 03:01:44.439664 IP 10.0.0.2.5001 > 10.0.0.3.33008: Flags [.], ack 7271, win 572, options [nop,nop,TS val 1338686431 ecr 3617347834], length 0
2026-05-28 03:01:44.439665 IP 10.0.0.3.33008 > 10.0.0.2.5001: Flags [.], seq 7271:8719, ack 1, win 502, options [nop,nop,TS val 3617347834 ecr 1338686418], length 1448
2026-05-28 03:01:44.439665 IP 10.0.0.2.5001 > 10.0.0.3.33008: Flags [.], ack 8719, win 561, options [nop,nop,TS val 1338686431 ecr 3617347834], length 0
2026-05-28 03:01:44.439665 IP 10.0.0.3.33008 > 10.0.0.2.5001: Flags [.], seq 8719:10167, ack 1, win 502, options [nop,nop,TS val 3617347834 ecr 1338686418], length 1448
2026-05-28 03:01:44.439666 IP 10.0.0.2.5001 > 10.0.0.3.33008: Flags [.], ack 10167, win 550, options [nop,nop,TS val 1338686431 ecr 3617347834], length 0
2026-05-28 03:01:44.439666 IP 10.0.0.3.33008 > 10.0.0.2.5001: Flags [.], seq 10167:11615, ack 1, win 502, options [nop,nop,TS val 3617347834 ecr 1338686418], length 1448
2026-05-28 03:01:44.439667 IP 10.0.0.2.5001 > 10.0.0.3.33008: Flags [.], ack 11615, win 539, options [nop,nop,TS val 1338686431 ecr 3617347834], length 0
2026-05-28 03:01:44.439667 IP 10.0.0.3.33008 > 10.0.0.2.5001: Flags [.], seq 11615:13063, ack 1, win 502, options [nop,nop,TS val 3617347834 ecr 1338686418], length 1448
2026-05-28 03:01:44.439668 IP 10.0.0.2.5001 > 10.0.0.3.33008: Flags [.], ack 13063, win 528, options [nop,nop,TS val 1338686431 ecr 3617347834], length 0
2026-05-28 03:01:44.452639 IP 10.0.0.3.33008 > 10.0.0.2.5001: Flags [P.], seq 13063:15959, ack 1, win 502, options [nop,nop,TS val 3617347847 ecr 1338686431], length 2896
2026-05-28 03:01:44.452652 IP 10.0.0.2.5001 > 10.0.0.3.33008: Flags [.], ack 15959, win 614, options [nop,nop,TS val 1338686444 ecr 3617347847], length 0
2026-05-28 03:01:44.452653 IP 10.0.0.3.33008 > 10.0.0.2.5001: Flags [P.], seq 15959:18855, ack 1, win 502, options [nop,nop,TS val 3617347847 ecr 1338686431], length 2896
2026-05-28 03:01:44.452655 IP 10.0.0.2.5001 > 10.0.0.3.33008: Flags [.], ack 18855, win 596, options [nop,nop,TS val 1338686444 ecr 3617347847], length 0
2026-05-28 03:01:44.452656 IP 10.0.0.3.33008 > 10.0.0.2.5001: Flags [P.], seq 18855:21031, ack 1, win 502, options [nop,nop,TS val 3617347847 ecr 1338686431], length 2176
2026-05-28 03:01:44.452658 IP 10.0.0.2.5001 > 10.0.0.3.33008: Flags [.], ack 21031, win 581, options [nop,nop,TS val 1338686444 ecr 3617347847], length 0
2026-05-28 03:01:44.452658 IP 10.0.0.3.33008 > 10.0.0.2.5001: Flags [.], seq 21031:22479, ack 1, win 502, options [nop,nop,TS val 3617347847 ecr 1338686431], length 1448
2026-05-28 03:01:44.452659 IP 10.0.0.2.5001 > 10.0.0.3.33008: Flags [.], ack 22479, win 570, options [nop,nop,TS val 1338686444 ecr 3617347847], length 0
2026-05-28 03:01:44.452659 IP 10.0.0.3.33008 > 10.0.0.2.5001: Flags [.], seq 22479:23927, ack 1, win 502, options [nop,nop,TS val 3617347847 ecr 1338686431], length 1448
2026-05-28 03:01:44.452661 IP 10.0.0.2.5001 > 10.0.0.3.33008: Flags [.], ack 23927, win 559, options [nop,nop,TS val 1338686444 ecr 3617347847], length 0
2026-05-28 03:01:44.452661 IP 10.0.0.3.33008 > 10.0.0.2.5001: Flags [.], seq 23927:25375, ack 1, win 502, options [nop,nop,TS val 3617347847 ecr 1338686431], length 1448
2026-05-28 03:01:44.452669 IP 10.0.0.2.5001 > 10.0.0.3.33008: Flags [.], ack 25375, win 548, options [nop,nop,TS val 1338686444 ecr 3617347847], length 0
2026-05-28 03:01:44.452669 IP 10.0.0.3.33008 > 10.0.0.2.5001: Flags [.], seq 25375:26823, ack 1, win 502, options [nop,nop,TS val 3617347847 ecr 1338686431], length 1448
2026-05-28 03:01:44.452670 IP 10.0.0.3.33008 > 10.0.0.2.5001: Flags [.], seq 26823:28271, ack 1, win 502, options [nop,nop,TS val 3617347847 ecr 1338686431], length 1448
2026-05-28 03:01:44.452670 IP 10.0.0.3.33008 > 10.0.0.2.5001: Flags [.], seq 28271:29719, ack 1, win 502, options [nop,nop,TS val 3617347847 ecr 1338686431], length 1448
2026-05-28 03:01:44.452670 IP 10.0.0.3.33008 > 10.0.0.2.5001: Flags [.], seq 29719:31167, ack 1, win 502, options [nop,nop,TS val 3617347847 ecr 1338686431], length 1448
2026-05-28 03:01:44.452671 IP 10.0.0.3.33008 > 10.0.0.2.5001: Flags [.], seq 31167:32615, ack 1, win 502, options [nop,nop,TS val 3617347847 ecr 1338686431], length 1448
2026-05-28 03:01:44.452683 IP 10.0.0.2.5001 > 10.0.0.3.33008: Flags [.], ack 32615, win 576, options [nop,nop,TS val 1338686444 ecr 3617347847], length 0
2026-05-28 03:01:44.464131 IP 10.0.0.3.33008 > 10.0.0.2.5001: Flags [P.], seq 32615:33631, ack 1, win 502, options [nop,nop,TS val 3617347860 ecr 1338686444], length 1016
2026-05-28 03:01:44.464140 IP 10.0.0.2.5001 > 10.0.0.3.33008: Flags [.], ack 33631, win 623, options [nop,nop,TS val 1338686456 ecr 3617347860], length 0
2026-05-28 03:01:44.464141 IP 10.0.0.3.33008 > 10.0.0.2.5001: Flags [.], seq 33631:35079, ack 1, win 502, options [nop,nop,TS val 3617347860 ecr 1338686444], length 1448
2026-05-28 03:01:44.464142 IP 10.0.0.2.5001 > 10.0.0.3.33008: Flags [.], ack 35079, win 612, options [nop,nop,TS val 1338686456 ecr 3617347860], length 0
2026-05-28 03:01:44.464142 IP 10.0.0.3.33008 > 10.0.0.2.5001: Flags [.], seq 35079:36527, ack 1, win 502, options [nop,nop,TS val 3617347860 ecr 1338686444], length 1448
2026-05-28 03:01:44.464143 IP 10.0.0.2.5001 > 10.0.0.3.33008: Flags [.], ack 36527, win 601, options [nop,nop,TS val 1338686456 ecr 3617347860], length 0
2026-05-28 03:01:44.464143 IP 10.0.0.3.33008 > 10.0.0.2.5001: Flags [.], seq 36527:37975, ack 1, win 502, options [nop,nop,TS val 3617347860 ecr 1338686444], length 1448
2026-05-28 03:01:44.464144 IP 10.0.0.3.33008 > 10.0.0.2.5001: Flags [.], seq 37975:39423, ack 1, win 502, options [nop,nop,TS val 3617347860 ecr 1338686444], length 1448
2026-05-28 03:01:44.464144 IP 10.0.0.3.33008 > 10.0.0.2.5001: Flags [.], seq 39423:40871, ack 1, win 502, options [nop,nop,TS val 3617347860 ecr 1338686444], length 1448
2026-05-28 03:01:44.464145 IP 10.0.0.3.33008 > 10.0.0.2.5001: Flags [.], seq 40871:42319, ack 1, win 502, options [nop,nop,TS val 3617347860 ecr 1338686444], length 1448
2026-05-28 03:01:44.464145 IP 10.0.0.3.33008 > 10.0.0.2.5001: Flags [.], seq 42319:43767, ack 1, win 502, options [nop,nop,TS val 3617347860 ecr 1338686444], length 1448
2026-05-28 03:01:44.464146 IP 10.0.0.3.33008 > 10.0.0.2.5001: Flags [.], seq 43767:45215, ack 1, win 502, options [nop,nop,TS val 3617347860 ecr 1338686444], length 1448
2026-05-28 03:01:44.464147 IP 10.0.0.3.33008 > 10.0.0.2.5001: Flags [.], seq 45215:46663, ack 1, win 502, options [nop,nop,TS val 3617347860 ecr 1338686444], length 1448
2026-05-28 03:01:44.464147 IP 10.0.0.3.33008 > 10.0.0.2.5001: Flags [.], seq 46663:48111, ack 1, win 502, options [nop,nop,TS val 3617347860 ecr 1338686444], length 1448
2026-05-28 03:01:44.464147 IP 10.0.0.3.33008 > 10.0.0.2.5001: Flags [.], seq 48111:49559, ack 1, win 502, options [nop,nop,TS val 3617347860 ecr 1338686444], length 1448
2026-05-28 03:01:44.464148 IP 10.0.0.3.33008 > 10.0.0.2.5001: Flags [.], seq 49559:51007, ack 1, win 502, options [nop,nop,TS val 3617347860 ecr 1338686444], length 1448
2026-05-28 03:01:44.464148 IP 10.0.0.3.33008 > 10.0.0.2.5001: Flags [.], seq 51007:52455, ack 1, win 502, options [nop,nop,TS val 3617347860 ecr 1338686444], length 1448
2026-05-28 03:01:44.464148 IP 10.0.0.3.33008 > 10.0.0.2.5001: Flags [.], seq 52455:53903, ack 1, win 502, options [nop,nop,TS val 3617347860 ecr 1338686444], length 1448
2026-05-28 03:01:44.464149 IP 10.0.0.3.33008 > 10.0.0.2.5001: Flags [.], seq 53903:55351, ack 1, win 502, options [nop,nop,TS val 3617347860 ecr 1338686444], length 1448
2026-05-28 03:01:44.464149 IP 10.0.0.3.33008 > 10.0.0.2.5001: Flags [.], seq 55351:56799, ack 1, win 502, options [nop,nop,TS val 3617347860 ecr 1338686444], length 1448
2026-05-28 03:01:44.464150 IP 10.0.0.3.33008 > 10.0.0.2.5001: Flags [.], seq 56799:58247, ack 1, win 502, options [nop,nop,TS val 3617347860 ecr 1338686444], length 1448
2026-05-28 03:01:44.464150 IP 10.0.0.3.33008 > 10.0.0.2.5001: Flags [.], seq 58247:59695, ack 1, win 502, options [nop,nop,TS val 3617347860 ecr 1338686444], length 1448
2026-05-28 03:01:44.464150 IP 10.0.0.3.33008 > 10.0.0.2.5001: Flags [.], seq 59695:61143, ack 1, win 502, options [nop,nop,TS val 3617347860 ecr 1338686444], length 1448
2026-05-28 03:01:44.464151 IP 10.0.0.3.33008 > 10.0.0.2.5001: Flags [.], seq 61143:62591, ack 1, win 502, options [nop,nop,TS val 3617347860 ecr 1338686444], length 1448
2026-05-28 03:01:44.464151 IP 10.0.0.3.33008 > 10.0.0.2.5001: Flags [.], seq 62591:64039, ack 1, win 502, options [nop,nop,TS val 3617347860 ecr 1338686444], length 1448
2026-05-28 03:01:44.464151 IP 10.0.0.3.33008 > 10.0.0.2.5001: Flags [.], seq 64039:65487, ack 1, win 502, options [nop,nop,TS val 3617347860 ecr 1338686444], length 1448
2026-05-28 03:01:44.464152 IP 10.0.0.3.33008 > 10.0.0.2.5001: Flags [.], seq 65487:66935, ack 1, win 502, options [nop,nop,TS val 3617347860 ecr 1338686444], length 1448
2026-05-28 03:01:44.464152 IP 10.0.0.3.33008 > 10.0.0.2.5001: Flags [.], seq 66935:68383, ack 1, win 502, options [nop,nop,TS val 3617347860 ecr 1338686444], length 1448
2026-05-28 03:01:44.464153 IP 10.0.0.3.33008 > 10.0.0.2.5001: Flags [.], seq 68383:69831, ack 1, win 502, options [nop,nop,TS val 3617347860 ecr 1338686444], length 1448
2026-05-28 03:01:44.464178 IP 10.0.0.2.5001 > 10.0.0.3.33008: Flags [.], ack 69831, win 623, options [nop,nop,TS val 1338686456 ecr 3617347860], length 0
2026-05-28 03:01:44.477782 IP 10.0.0.3.33008 > 10.0.0.2.5001: Flags [P.], seq 69831:72727, ack 1, win 502, options [nop,nop,TS val 3617347872 ecr 1338686456], length 2896
2026-05-28 03:01:44.477791 IP 10.0.0.3.33008 > 10.0.0.2.5001: Flags [P.], seq 72727:77031, ack 1, win 502, options [nop,nop,TS val 3617347872 ecr 1338686456], length 4304
2026-05-28 03:01:44.477793 IP 10.0.0.3.33008 > 10.0.0.2.5001: Flags [P.], seq 77031:81375, ack 1, win 502, options [nop,nop,TS val 3617347872 ecr 1338686456], length 4344
2026-05-28 03:01:44.477793 IP 10.0.0.3.33008 > 10.0.0.2.5001: Flags [.], seq 81375:82823, ack 1, win 502, options [nop,nop,TS val 3617347872 ecr 1338686456], length 1448
2026-05-28 03:01:44.477794 IP 10.0.0.3.33008 > 10.0.0.2.5001: Flags [.], seq 82823:84271, ack 1, win 502, options [nop,nop,TS val 3617347872 ecr 1338686456], length 1448
2026-05-28 03:01:44.477795 IP 10.0.0.3.33008 > 10.0.0.2.5001: Flags [.], seq 84271:85719, ack 1, win 502, options [nop,nop,TS val 3617347872 ecr 1338686456], length 1448
2026-05-28 03:01:44.477795 IP 10.0.0.3.33008 > 10.0.0.2.5001: Flags [.], seq 85719:87167, ack 1, win 502, options [nop,nop,TS val 3617347872 ecr 1338686456], length 1448
2026-05-28 03:01:44.477796 IP 10.0.0.3.33008 > 10.0.0.2.5001: Flags [.], seq 87167:88615, ack 1, win 502, options [nop,nop,TS val 3617347872 ecr 1338686456], length 1448
2026-05-28 03:01:44.477796 IP 10.0.0.3.33008 > 10.0.0.2.5001: Flags [.], seq 88615:90063, ack 1, win 502, options [nop,nop,TS val 3617347872 ecr 1338686456], length 1448
2026-05-28 03:01:44.477797 IP 10.0.0.3.33008 > 10.0.0.2.5001: Flags [.], seq 90063:91511, ack 1, win 502, options [nop,nop,TS val 3617347872 ecr 1338686456], length 1448
2026-05-28 03:01:44.477797 IP 10.0.0.3.33008 > 10.0.0.2.5001: Flags [.], seq 91511:92959, ack 1, win 502, options [nop,nop,TS val 3617347872 ecr 1338686456], length 1448
2026-05-28 03:01:44.477798 IP 10.0.0.3.33008 > 10.0.0.2.5001: Flags [.], seq 92959:94407, ack 1, win 502, options [nop,nop,TS val 3617347872 ecr 1338686456], length 1448
2026-05-28 03:01:44.477798 IP 10.0.0.3.33008 > 10.0.0.2.5001: Flags [.], seq 94407:95855, ack 1, win 502, options [nop,nop,TS val 3617347872 ecr 1338686456], length 1448
2026-05-28 03:01:44.477799 IP 10.0.0.3.33008 > 10.0.0.2.5001: Flags [.], seq 95855:97303, ack 1, win 502, options [nop,nop,TS val 3617347872 ecr 1338686456], length 1448
2026-05-28 03:01:44.477800 IP 10.0.0.3.33008 > 10.0.0.2.5001: Flags [.], seq 97303:98751, ack 1, win 502, options [nop,nop,TS val 3617347872 ecr 1338686456], length 1448
2026-05-28 03:01:44.477800 IP 10.0.0.3.33008 > 10.0.0.2.5001: Flags [.], seq 98751:100199, ack 1, win 502, options [nop,nop,TS val 3617347872 ecr 1338686456], length 1448
2026-05-28 03:01:44.477801 IP 10.0.0.3.33008 > 10.0.0.2.5001: Flags [.], seq 100199:101647, ack 1, win 502, options [nop,nop,TS val 3617347872 ecr 1338686456], length 1448
2026-05-28 03:01:44.477801 IP 10.0.0.3.33008 > 10.0.0.2.5001: Flags [.], seq 101647:103095, ack 1, win 502, options [nop,nop,TS val 3617347872 ecr 1338686456], length 1448
2026-05-28 03:01:44.477802 IP 10.0.0.3.33008 > 10.0.0.2.5001: Flags [.], seq 103095:104543, ack 1, win 502, options [nop,nop,TS val 3617347872 ecr 1338686456], length 1448
2026-05-28 03:01:44.477802 IP 10.0.0.3.33008 > 10.0.0.2.5001: Flags [.], seq 104543:105991, ack 1, win 502, options [nop,nop,TS val 3617347872 ecr 1338686456], length 1448
2026-05-28 03:01:44.477802 IP 10.0.0.3.33008 > 10.0.0.2.5001: Flags [.], seq 105991:107439, ack 1, win 502, options [nop,nop,TS val 3617347872 ecr 1338686456], length 1448
2026-05-28 03:01:44.477803 IP 10.0.0.3.33008 > 10.0.0.2.5001: Flags [.], seq 107439:108887, ack 1, win 502, options [nop,nop,TS val 3617347872 ecr 1338686456], length 1448
2026-05-28 03:01:44.477805 IP 10.0.0.3.33008 > 10.0.0.2.5001: Flags [.], seq 108887:110335, ack 1, win 502, options [nop,nop,TS val 3617347872 ecr 1338686456], length 1448
2026-05-28 03:01:44.477805 IP 10.0.0.3.33008 > 10.0.0.2.5001: Flags [.], seq 110335:111783, ack 1, win 502, options [nop,nop,TS val 3617347872 ecr 1338686456], length 1448
2026-05-28 03:01:44.477805 IP 10.0.0.3.33008 > 10.0.0.2.5001: Flags [.], seq 111783:113231, ack 1, win 502, options [nop,nop,TS val 3617347872 ecr 1338686456], length 1448
2026-05-28 03:01:44.477806 IP 10.0.0.3.33008 > 10.0.0.2.5001: Flags [.], seq 113231:114679, ack 1, win 502, options [nop,nop,TS val 3617347872 ecr 1338686456], length 1448
2026-05-28 03:01:44.477807 IP 10.0.0.3.33008 > 10.0.0.2.5001: Flags [.], seq 114679:116127, ack 1, win 502, options [nop,nop,TS val 3617347872 ecr 1338686456], length 1448
2026-05-28 03:01:44.477807 IP 10.0.0.3.33008 > 10.0.0.2.5001: Flags [.], seq 116127:117575, ack 1, win 502, options [nop,nop,TS val 3617347872 ecr 1338686456], length 1448
2026-05-28 03:01:44.477807 IP 10.0.0.3.33008 > 10.0.0.2.5001: Flags [.], seq 117575:119023, ack 1, win 502, options [nop,nop,TS val 3617347872 ecr 1338686456], length 1448
2026-05-28 03:01:44.477808 IP 10.0.0.3.33008 > 10.0.0.2.5001: Flags [.], seq 119023:120471, ack 1, win 502, options [nop,nop,TS val 3617347872 ecr 1338686456], length 1448
2026-05-28 03:01:44.477808 IP 10.0.0.3.33008 > 10.0.0.2.5001: Flags [.], seq 120471:121919, ack 1, win 502, options [nop,nop,TS val 3617347872 ecr 1338686456], length 1448
2026-05-28 03:01:44.477809 IP 10.0.0.3.33008 > 10.0.0.2.5001: Flags [.], seq 121919:123367, ack 1, win 502, options [nop,nop,TS val 3617347872 ecr 1338686456], length 1448
2026-05-28 03:01:44.477810 IP 10.0.0.3.33008 > 10.0.0.2.5001: Flags [.], seq 123367:124815, ack 1, win 502, options [nop,nop,TS val 3617347872 ecr 1338686456], length 1448
2026-05-28 03:01:44.477837 IP 10.0.0.2.5001 > 10.0.0.3.33008: Flags [.], ack 124815, win 623, options [nop,nop,TS val 1338686469 ecr 3617347872], length 0
2026-05-28 03:01:44.490632 IP 10.0.0.3.33008 > 10.0.0.2.5001: Flags [P.], seq 124815:126031, ack 1, win 502, options [nop,nop,TS val 3617347885 ecr 1338686469], length 1216
2026-05-28 03:01:44.490637 IP 10.0.0.3.33008 > 10.0.0.2.5001: Flags [.], seq 126031:127479, ack 1, win 502, options [nop,nop,TS val 3617347885 ecr 1338686469], length 1448
2026-05-28 03:01:44.490638 IP 10.0.0.3.33008 > 10.0.0.2.5001: Flags [.], seq 127479:128927, ack 1, win 502, options [nop,nop,TS val 3617347885 ecr 1338686469], length 1448
2026-05-28 03:01:44.490638 IP 10.0.0.3.33008 > 10.0.0.2.5001: Flags [.], seq 128927:130375, ack 1, win 502, options [nop,nop,TS val 3617347885 ecr 1338686469], length 1448
2026-05-28 03:01:44.490639 IP 10.0.0.3.33008 > 10.0.0.2.5001: Flags [.], seq 130375:131823, ack 1, win 502, options [nop,nop,TS val 3617347885 ecr 1338686469], length 1448
2026-05-28 03:01:44.490640 IP 10.0.0.3.33008 > 10.0.0.2.5001: Flags [.], seq 131823:133271, ack 1, win 502, options [nop,nop,TS val 3617347885 ecr 1338686469], length 1448
2026-05-28 03:01:44.490640 IP 10.0.0.3.33008 > 10.0.0.2.5001: Flags [.], seq 133271:134719, ack 1, win 502, options [nop,nop,TS val 3617347885 ecr 1338686469], length 1448
2026-05-28 03:01:44.490641 IP 10.0.0.3.33008 > 10.0.0.2.5001: Flags [.], seq 134719:136167, ack 1, win 502, options [nop,nop,TS val 3617347885 ecr 1338686469], length 1448
2026-05-28 03:01:44.490641 IP 10.0.0.3.33008 > 10.0.0.2.5001: Flags [.], seq 136167:137615, ack 1, win 502, options [nop,nop,TS val 3617347885 ecr 1338686469], length 1448
2026-05-28 03:01:44.490652 IP 10.0.0.3.33008 > 10.0.0.2.5001: Flags [.], seq 137615:139063, ack 1, win 502, options [nop,nop,TS val 3617347885 ecr 1338686469], length 1448
2026-05-28 03:01:44.490652 IP 10.0.0.3.33008 > 10.0.0.2.5001: Flags [.], seq 139063:140511, ack 1, win 502, options [nop,nop,TS val 3617347885 ecr 1338686469], length 1448
2026-05-28 03:01:44.490653 IP 10.0.0.3.33008 > 10.0.0.2.5001: Flags [.], seq 140511:141959, ack 1, win 502, options [nop,nop,TS val 3617347885 ecr 1338686469], length 1448
2026-05-28 03:01:44.490653 IP 10.0.0.3.33008 > 10.0.0.2.5001: Flags [.], seq 141959:143407, ack 1, win 502, options [nop,nop,TS val 3617347885 ecr 1338686469], length 1448
2026-05-28 03:01:44.490653 IP 10.0.0.3.33008 > 10.0.0.2.5001: Flags [.], seq 143407:144855, ack 1, win 502, options [nop,nop,TS val 3617347885 ecr 1338686469], length 1448
2026-05-28 03:01:44.490654 IP 10.0.0.3.33008 > 10.0.0.2.5001: Flags [.], seq 144855:146303, ack 1, win 502, options [nop,nop,TS val 3617347885 ecr 1338686469], length 1448
2026-05-28 03:01:44.490654 IP 10.0.0.3.33008 > 10.0.0.2.5001: Flags [.], seq 146303:147751, ack 1, win 502, options [nop,nop,TS val 3617347885 ecr 1338686469], length 1448
2026-05-28 03:01:44.490655 IP 10.0.0.3.33008 > 10.0.0.2.5001: Flags [.], seq 147751:149199, ack 1, win 502, options [nop,nop,TS val 3617347885 ecr 1338686469], length 1448
2026-05-28 03:01:44.490655 IP 10.0.0.3.33008 > 10.0.0.2.5001: Flags [.], seq 149199:150647, ack 1, win 502, options [nop,nop,TS val 3617347885 ecr 1338686469], length 1448
2026-05-28 03:01:44.490655 IP 10.0.0.3.33008 > 10.0.0.2.5001: Flags [.], seq 150647:152095, ack 1, win 502, options [nop,nop,TS val 3617347885 ecr 1338686469], length 1448
2026-05-28 03:01:44.490656 IP 10.0.0.3.33008 > 10.0.0.2.5001: Flags [.], seq 152095:153543, ack 1, win 502, options [nop,nop,TS val 3617347885 ecr 1338686469], length 1448
2026-05-28 03:01:44.490656 IP 10.0.0.3.33008 > 10.0.0.2.5001: Flags [.], seq 153543:154991, ack 1, win 502, options [nop,nop,TS val 3617347885 ecr 1338686469], length 1448
2026-05-28 03:01:44.490657 IP 10.0.0.3.33008 > 10.0.0.2.5001: Flags [.], seq 154991:156439, ack 1, win 502, options [nop,nop,TS val 3617347885 ecr 1338686469], length 1448
2026-05-28 03:01:44.490657 IP 10.0.0.3.33008 > 10.0.0.2.5001: Flags [.], seq 156439:157887, ack 1, win 502, options [nop,nop,TS val 3617347885 ecr 1338686469], length 1448
2026-05-28 03:01:44.490658 IP 10.0.0.3.33008 > 10.0.0.2.5001: Flags [.], seq 157887:159335, ack 1, win 502, options [nop,nop,TS val 3617347885 ecr 1338686469], length 1448
2026-05-28 03:01:44.490658 IP 10.0.0.3.33008 > 10.0.0.2.5001: Flags [.], seq 159335:160783, ack 1, win 502, options [nop,nop,TS val 3617347885 ecr 1338686469], length 1448
2026-05-28 03:01:44.490658 IP 10.0.0.3.33008 > 10.0.0.2.5001: Flags [.], seq 160783:162231, ack 1, win 502, options [nop,nop,TS val 3617347885 ecr 1338686469], length 1448
2026-05-28 03:01:44.490659 IP 10.0.0.3.33008 > 10.0.0.2.5001: Flags [.], seq 162231:163679, ack 1, win 502, options [nop,nop,TS val 3617347885 ecr 1338686469], length 1448
2026-05-28 03:01:44.490659 IP 10.0.0.3.33008 > 10.0.0.2.5001: Flags [.], seq 163679:165127, ack 1, win 502, options [nop,nop,TS val 3617347885 ecr 1338686469], length 1448
2026-05-28 03:01:44.490660 IP 10.0.0.3.33008 > 10.0.0.2.5001: Flags [.], seq 165127:166575, ack 1, win 502, options [nop,nop,TS val 3617347885 ecr 1338686469], length 1448
2026-05-28 03:01:44.490660 IP 10.0.0.3.33008 > 10.0.0.2.5001: Flags [.], seq 166575:168023, ack 1, win 502, options [nop,nop,TS val 3617347885 ecr 1338686469], length 1448
2026-05-28 03:01:44.490661 IP 10.0.0.3.33008 > 10.0.0.2.5001: Flags [.], seq 168023:169471, ack 1, win 502, options [nop,nop,TS val 3617347885 ecr 1338686469], length 1448
2026-05-28 03:01:44.490661 IP 10.0.0.3.33008 > 10.0.0.2.5001: Flags [.], seq 169471:170919, ack 1, win 502, options [nop,nop,TS val 3617347885 ecr 1338686469], length 1448
2026-05-28 03:01:44.490662 IP 10.0.0.3.33008 > 10.0.0.2.5001: Flags [.], seq 170919:172367, ack 1, win 502, options [nop,nop,TS val 3617347885 ecr 1338686469], length 1448
2026-05-28 03:01:44.490662 IP 10.0.0.3.33008 > 10.0.0.2.5001: Flags [.], seq 172367:173815, ack 1, win 502, options [nop,nop,TS val 3617347885 ecr 1338686469], length 1448
2026-05-28 03:01:44.490662 IP 10.0.0.3.33008 > 10.0.0.2.5001: Flags [.], seq 173815:175263, ack 1, win 502, options [nop,nop,TS val 3617347885 ecr 1338686469], length 1448
2026-05-28 03:01:44.490663 IP 10.0.0.3.33008 > 10.0.0.2.5001: Flags [.], seq 175263:176711, ack 1, win 502, options [nop,nop,TS val 3617347885 ecr 1338686469], length 1448
2026-05-28 03:01:44.490663 IP 10.0.0.3.33008 > 10.0.0.2.5001: Flags [.], seq 176711:178159, ack 1, win 502, options [nop,nop,TS val 3617347885 ecr 1338686469], length 1448
2026-05-28 03:01:44.490664 IP 10.0.0.3.33008 > 10.0.0.2.5001: Flags [.], seq 178159:179607, ack 1, win 502, options [nop,nop,TS val 3617347885 ecr 1338686469], length 1448
2026-05-28 03:01:44.490664 IP 10.0.0.3.33008 > 10.0.0.2.5001: Flags [.], seq 179607:181055, ack 1, win 502, options [nop,nop,TS val 3617347885 ecr 1338686469], length 1448
2026-05-28 03:01:44.490664 IP 10.0.0.3.33008 > 10.0.0.2.5001: Flags [.], seq 181055:182503, ack 1, win 502, options [nop,nop,TS val 3617347885 ecr 1338686469], length 1448
2026-05-28 03:01:44.490665 IP 10.0.0.3.33008 > 10.0.0.2.5001: Flags [.], seq 182503:183951, ack 1, win 502, options [nop,nop,TS val 3617347885 ecr 1338686469], length 1448
2026-05-28 03:01:44.490665 IP 10.0.0.3.33008 > 10.0.0.2.5001: Flags [.], seq 183951:185399, ack 1, win 502, options [nop,nop,TS val 3617347885 ecr 1338686469], length 1448
2026-05-28 03:01:44.490666 IP 10.0.0.3.33008 > 10.0.0.2.5001: Flags [.], seq 185399:186847, ack 1, win 502, options [nop,nop,TS val 3617347885 ecr 1338686469], length 1448
2026-05-28 03:01:44.490666 IP 10.0.0.3.33008 > 10.0.0.2.5001: Flags [.], seq 186847:188295, ack 1, win 502, options [nop,nop,TS val 3617347885 ecr 1338686469], length 1448
2026-05-28 03:01:44.490667 IP 10.0.0.3.33008 > 10.0.0.2.5001: Flags [.], seq 188295:189743, ack 1, win 502, options [nop,nop,TS val 3617347885 ecr 1338686469], length 1448
2026-05-28 03:01:44.490667 IP 10.0.0.3.33008 > 10.0.0.2.5001: Flags [.], seq 189743:191191, ack 1, win 502, options [nop,nop,TS val 3617347885 ecr 1338686469], length 1448
2026-05-28 03:01:44.490667 IP 10.0.0.3.33008 > 10.0.0.2.5001: Flags [.], seq 191191:192639, ack 1, win 502, options [nop,nop,TS val 3617347885 ecr 1338686469], length 1448
2026-05-28 03:01:44.490668 IP 10.0.0.3.33008 > 10.0.0.2.5001: Flags [.], seq 192639:194087, ack 1, win 502, options [nop,nop,TS val 3617347885 ecr 1338686469], length 1448
2026-05-28 03:01:44.490668 IP 10.0.0.3.33008 > 10.0.0.2.5001: Flags [.], seq 194087:195535, ack 1, win 502, options [nop,nop,TS val 3617347885 ecr 1338686469], length 1448
2026-05-28 03:01:44.490669 IP 10.0.0.3.33008 > 10.0.0.2.5001: Flags [.], seq 195535:196983, ack 1, win 502, options [nop,nop,TS val 3617347885 ecr 1338686469], length 1448
2026-05-28 03:01:44.490669 IP 10.0.0.3.33008 > 10.0.0.2.5001: Flags [.], seq 196983:198431, ack 1, win 502, options [nop,nop,TS val 3617347885 ecr 1338686469], length 1448
2026-05-28 03:01:44.490670 IP 10.0.0.3.33008 > 10.0.0.2.5001: Flags [.], seq 198431:199879, ack 1, win 502, options [nop,nop,TS val 3617347885 ecr 1338686469], length 1448
2026-05-28 03:01:44.490670 IP 10.0.0.3.33008 > 10.0.0.2.5001: Flags [.], seq 199879:201327, ack 1, win 502, options [nop,nop,TS val 3617347885 ecr 1338686469], length 1448
2026-05-28 03:01:44.490670 IP 10.0.0.3.33008 > 10.0.0.2.5001: Flags [.], seq 201327:202775, ack 1, win 502, options [nop,nop,TS val 3617347885 ecr 1338686469], length 1448
2026-05-28 03:01:44.490671 IP 10.0.0.3.33008 > 10.0.0.2.5001: Flags [.], seq 202775:204223, ack 1, win 502, options [nop,nop,TS val 3617347885 ecr 1338686469], length 1448
2026-05-28 03:01:44.490690 IP 10.0.0.2.5001 > 10.0.0.3.33008: Flags [.], ack 204223, win 519, options [nop,nop,TS val 1338686482 ecr 3617347885], length 0
2026-05-28 03:01:44.502692 IP 10.0.0.3.33008 > 10.0.0.2.5001: Flags [P.], seq 204223:236079, ack 1, win 502, options [nop,nop,TS val 3617347898 ecr 1338686482], length 31856
2026-05-28 03:01:44.502708 IP 10.0.0.3.33008 > 10.0.0.2.5001: Flags [P.], seq 236079:267935, ack 1, win 502, options [nop,nop,TS val 3617347898 ecr 1338686482], length 31856
2026-05-28 03:01:44.502711 IP 10.0.0.3.33008 > 10.0.0.2.5001: Flags [P.], seq 267935:270655, ack 1, win 502, options [nop,nop,TS val 3617347898 ecr 1338686482], length 2720
2026-05-28 03:01:44.502723 IP 10.0.0.2.5001 > 10.0.0.3.33008: Flags [.], ack 270655, win 623, options [nop,nop,TS val 1338686494 ecr 3617347898], length 0
2026-05-28 03:01:44.515608 IP 10.0.0.3.33008 > 10.0.0.2.5001: Flags [P.], seq 270655:302511, ack 1, win 502, options [nop,nop,TS val 3617347910 ecr 1338686494], length 31856
2026-05-28 03:01:44.515615 IP 10.0.0.2.5001 > 10.0.0.3.33008: Flags [.], ack 302511, win 1121, options [nop,nop,TS val 1338686507 ecr 3617347910], length 0
2026-05-28 03:01:44.515618 IP 10.0.0.3.33008 > 10.0.0.2.5001: Flags [P.], seq 302511:334367, ack 1, win 502, options [nop,nop,TS val 3617347910 ecr 1338686494], length 31856
2026-05-28 03:01:44.515619 IP 10.0.0.2.5001 > 10.0.0.3.33008: Flags [.], ack 334367, win 1619, options [nop,nop,TS val 1338686507 ecr 3617347910], length 0
2026-05-28 03:01:44.515620 IP 10.0.0.3.33008 > 10.0.0.2.5001: Flags [P.], seq 334367:350399, ack 1, win 502, options [nop,nop,TS val 3617347910 ecr 1338686494], length 16032
2026-05-28 03:01:44.515622 IP 10.0.0.2.5001 > 10.0.0.3.33008: Flags [.], ack 350399, win 1869, options [nop,nop,TS val 1338686507 ecr 3617347910], length 0
2026-05-28 03:01:44.528632 IP 10.0.0.3.33008 > 10.0.0.2.5001: Flags [P.], seq 350399:382255, ack 1, win 502, options [nop,nop,TS val 3617347923 ecr 1338686507], length 31856
2026-05-28 03:01:44.528637 IP 10.0.0.2.5001 > 10.0.0.3.33008: Flags [.], ack 382255, win 2367, options [nop,nop,TS val 1338686520 ecr 3617347923], length 0
2026-05-28 03:01:44.528640 IP 10.0.0.3.33008 > 10.0.0.2.5001: Flags [P.], seq 382255:414111, ack 1, win 502, options [nop,nop,TS val 3617347923 ecr 1338686507], length 31856
2026-05-28 03:01:44.528641 IP 10.0.0.2.5001 > 10.0.0.3.33008: Flags [.], ack 414111, win 2865, options [nop,nop,TS val 1338686520 ecr 3617347923], length 0
2026-05-28 03:01:44.528644 IP 10.0.0.3.33008 > 10.0.0.2.5001: Flags [P.], seq 414111:445967, ack 1, win 502, options [nop,nop,TS val 3617347923 ecr 1338686507], length 31856
2026-05-28 03:01:44.528645 IP 10.0.0.2.5001 > 10.0.0.3.33008: Flags [.], ack 445967, win 3363, options [nop,nop,TS val 1338686520 ecr 3617347923], length 0
2026-05-28 03:01:44.528647 IP 10.0.0.3.33008 > 10.0.0.2.5001: Flags [P.], seq 445967:483615, ack 1, win 502, options [nop,nop,TS val 3617347923 ecr 1338686507], length 37648
2026-05-28 03:01:44.528648 IP 10.0.0.2.5001 > 10.0.0.3.33008: Flags [.], ack 483615, win 3951, options [nop,nop,TS val 1338686520 ecr 3617347923], length 0
2026-05-28 03:01:44.528659 IP 10.0.0.3.33008 > 10.0.0.2.5001: Flags [P.], seq 483615:521263, ack 1, win 502, options [nop,nop,TS val 3617347923 ecr 1338686507], length 37648
2026-05-28 03:01:44.528662 IP 10.0.0.2.5001 > 10.0.0.3.33008: Flags [.], ack 521263, win 4539, options [nop,nop,TS val 1338686520 ecr 3617347923], length 0
2026-05-28 03:01:44.528665 IP 10.0.0.3.33008 > 10.0.0.2.5001: Flags [P.], seq 521263:560359, ack 1, win 502, options [nop,nop,TS val 3617347923 ecr 1338686507], length 39096
2026-05-28 03:01:44.528666 IP 10.0.0.2.5001 > 10.0.0.3.33008: Flags [.], ack 560359, win 5150, options [nop,nop,TS val 1338686520 ecr 3617347923], length 0
2026-05-28 03:01:44.528668 IP 10.0.0.3.33008 > 10.0.0.2.5001: Flags [P.], seq 560359:589631, ack 1, win 502, options [nop,nop,TS val 3617347923 ecr 1338686507], length 29272
2026-05-28 03:01:44.528669 IP 10.0.0.2.5001 > 10.0.0.3.33008: Flags [.], ack 589631, win 5607, options [nop,nop,TS val 1338686520 ecr 3617347923], length 0
2026-05-28 03:01:44.540196 IP 10.0.0.3.33008 > 10.0.0.2.5001: Flags [P.], seq 589631:634279, ack 1, win 502, options [nop,nop,TS val 3617347936 ecr 1338686520], length 44648
2026-05-28 03:01:44.540204 IP 10.0.0.2.5001 > 10.0.0.3.33008: Flags [.], ack 634279, win 6305, options [nop,nop,TS val 1338686532 ecr 3617347936], length 0
2026-05-28 03:01:44.540207 IP 10.0.0.3.33008 > 10.0.0.2.5001: Flags [P.], seq 634279:683511, ack 1, win 502, options [nop,nop,TS val 3617347936 ecr 1338686520], length 49232
2026-05-28 03:01:44.540208 IP 10.0.0.2.5001 > 10.0.0.3.33008: Flags [.], ack 683511, win 7074, options [nop,nop,TS val 1338686532 ecr 3617347936], length 0
2026-05-28 03:01:44.540211 IP 10.0.0.3.33008 > 10.0.0.2.5001: Flags [P.], seq 683511:732743, ack 1, win 502, options [nop,nop,TS val 3617347936 ecr 1338686520], length 49232
2026-05-28 03:01:44.540213 IP 10.0.0.2.5001 > 10.0.0.3.33008: Flags [.], ack 732743, win 7843, options [nop,nop,TS val 1338686532 ecr 3617347936], length 0
2026-05-28 03:01:44.540225 IP 10.0.0.3.33008 > 10.0.0.2.5001: Flags [P.], seq 732743:784871, ack 1, win 502, options [nop,nop,TS val 3617347936 ecr 1338686520], length 52128
2026-05-28 03:01:44.540228 IP 10.0.0.2.5001 > 10.0.0.3.33008: Flags [.], ack 784871, win 8658, options [nop,nop,TS val 1338686532 ecr 3617347936], length 0
2026-05-28 03:01:44.540228 IP 10.0.0.3.33008 > 10.0.0.2.5001: Flags [.], seq 784871:786319, ack 1, win 502, options [nop,nop,TS val 3617347936 ecr 1338686520], length 1448
2026-05-28 03:01:44.540230 IP 10.0.0.2.5001 > 10.0.0.3.33008: Flags [.], ack 786319, win 8681, options [nop,nop,TS val 1338686532 ecr 3617347936], length 0
2026-05-28 03:01:44.540230 IP 10.0.0.3.33008 > 10.0.0.2.5001: Flags [.], seq 786319:787767, ack 1, win 502, options [nop,nop,TS val 3617347936 ecr 1338686520], length 1448
2026-05-28 03:01:44.540232 IP 10.0.0.2.5001 > 10.0.0.3.33008: Flags [.], ack 787767, win 8703, options [nop,nop,TS val 1338686532 ecr 3617347936], length 0
2026-05-28 03:01:44.540232 IP 10.0.0.3.33008 > 10.0.0.2.5001: Flags [.], seq 787767:789215, ack 1, win 502, options [nop,nop,TS val 3617347936 ecr 1338686520], length 1448
2026-05-28 03:01:44.540233 IP 10.0.0.2.5001 > 10.0.0.3.33008: Flags [.], ack 789215, win 8726, options [nop,nop,TS val 1338686532 ecr 3617347936], length 0
2026-05-28 03:01:44.540234 IP 10.0.0.3.33008 > 10.0.0.2.5001: Flags [.], seq 789215:790663, ack 1, win 502, options [nop,nop,TS val 3617347936 ecr 1338686520], length 1448
2026-05-28 03:01:44.540235 IP 10.0.0.2.5001 > 10.0.0.3.33008: Flags [.], ack 790663, win 8748, options [nop,nop,TS val 1338686532 ecr 3617347936], length 0
2026-05-28 03:01:44.540235 IP 10.0.0.3.33008 > 10.0.0.2.5001: Flags [.], seq 790663:792111, ack 1, win 502, options [nop,nop,TS val 3617347936 ecr 1338686520], length 1448
2026-05-28 03:01:44.540236 IP 10.0.0.2.5001 > 10.0.0.3.33008: Flags [.], ack 792111, win 8771, options [nop,nop,TS val 1338686532 ecr 3617347936], length 0
2026-05-28 03:01:44.540236 IP 10.0.0.3.33008 > 10.0.0.2.5001: Flags [.], seq 792111:793559, ack 1, win 502, options [nop,nop,TS val 3617347936 ecr 1338686520], length 1448
2026-05-28 03:01:44.540238 IP 10.0.0.2.5001 > 10.0.0.3.33008: Flags [.], ack 793559, win 8794, options [nop,nop,TS val 1338686532 ecr 3617347936], length 0
2026-05-28 03:01:44.540238 IP 10.0.0.3.33008 > 10.0.0.2.5001: Flags [.], seq 793559:795007, ack 1, win 502, options [nop,nop,TS val 3617347936 ecr 1338686520], length 1448
2026-05-28 03:01:44.540239 IP 10.0.0.2.5001 > 10.0.0.3.33008: Flags [.], ack 795007, win 8816, options [nop,nop,TS val 1338686532 ecr 3617347936], length 0
2026-05-28 03:01:44.540239 IP 10.0.0.3.33008 > 10.0.0.2.5001: Flags [.], seq 795007:796455, ack 1, win 502, options [nop,nop,TS val 3617347936 ecr 1338686520], length 1448
2026-05-28 03:01:44.540241 IP 10.0.0.2.5001 > 10.0.0.3.33008: Flags [.], ack 796455, win 8839, options [nop,nop,TS val 1338686532 ecr 3617347936], length 0
2026-05-28 03:01:44.540241 IP 10.0.0.3.33008 > 10.0.0.2.5001: Flags [.], seq 796455:797903, ack 1, win 502, options [nop,nop,TS val 3617347936 ecr 1338686520], length 1448
2026-05-28 03:01:44.540242 IP 10.0.0.2.5001 > 10.0.0.3.33008: Flags [.], ack 797903, win 8862, options [nop,nop,TS val 1338686532 ecr 3617347936], length 0
2026-05-28 03:01:44.540242 IP 10.0.0.3.33008 > 10.0.0.2.5001: Flags [.], seq 797903:799351, ack 1, win 502, options [nop,nop,TS val 3617347936 ecr 1338686520], length 1448
2026-05-28 03:01:44.540243 IP 10.0.0.2.5001 > 10.0.0.3.33008: Flags [.], ack 799351, win 8884, options [nop,nop,TS val 1338686532 ecr 3617347936], length 0
2026-05-28 03:01:44.540244 IP 10.0.0.3.33008 > 10.0.0.2.5001: Flags [.], seq 799351:800799, ack 1, win 502, options [nop,nop,TS val 3617347936 ecr 1338686520], length 1448
2026-05-28 03:01:44.540244 IP 10.0.0.2.5001 > 10.0.0.3.33008: Flags [.], ack 800799, win 8907, options [nop,nop,TS val 1338686532 ecr 3617347936], length 0
2026-05-28 03:01:44.540245 IP 10.0.0.3.33008 > 10.0.0.2.5001: Flags [.], seq 800799:802247, ack 1, win 502, options [nop,nop,TS val 3617347936 ecr 1338686520], length 1448
2026-05-28 03:01:44.540246 IP 10.0.0.2.5001 > 10.0.0.3.33008: Flags [.], ack 802247, win 8929, options [nop,nop,TS val 1338686532 ecr 3617347936], length 0
2026-05-28 03:01:44.540246 IP 10.0.0.3.33008 > 10.0.0.2.5001: Flags [.], seq 802247:803695, ack 1, win 502, options [nop,nop,TS val 3617347936 ecr 1338686520], length 1448
2026-05-28 03:01:44.540247 IP 10.0.0.2.5001 > 10.0.0.3.33008: Flags [.], ack 803695, win 8952, options [nop,nop,TS val 1338686532 ecr 3617347936], length 0
2026-05-28 03:01:44.540248 IP 10.0.0.3.33008 > 10.0.0.2.5001: Flags [.], seq 803695:805143, ack 1, win 502, options [nop,nop,TS val 3617347936 ecr 1338686520], length 1448
2026-05-28 03:01:44.540249 IP 10.0.0.2.5001 > 10.0.0.3.33008: Flags [.], ack 805143, win 8975, options [nop,nop,TS val 1338686532 ecr 3617347936], length 0
2026-05-28 03:01:44.540249 IP 10.0.0.3.33008 > 10.0.0.2.5001: Flags [.], seq 805143:806591, ack 1, win 502, options [nop,nop,TS val 3617347936 ecr 1338686520], length 1448
2026-05-28 03:01:44.540250 IP 10.0.0.2.5001 > 10.0.0.3.33008: Flags [.], ack 806591, win 8997, options [nop,nop,TS val 1338686532 ecr 3617347936], length 0
2026-05-28 03:01:44.540251 IP 10.0.0.3.33008 > 10.0.0.2.5001: Flags [.], seq 806591:808039, ack 1, win 502, options [nop,nop,TS val 3617347936 ecr 1338686520], length 1448
2026-05-28 03:01:44.540252 IP 10.0.0.2.5001 > 10.0.0.3.33008: Flags [.], ack 808039, win 9020, options [nop,nop,TS val 1338686532 ecr 3617347936], length 0
2026-05-28 03:01:44.540252 IP 10.0.0.3.33008 > 10.0.0.2.5001: Flags [.], seq 808039:809487, ack 1, win 502, options [nop,nop,TS val 3617347936 ecr 1338686520], length 1448
2026-05-28 03:01:44.540253 IP 10.0.0.2.5001 > 10.0.0.3.33008: Flags [.], ack 809487, win 9043, options [nop,nop,TS val 1338686532 ecr 3617347936], length 0
2026-05-28 03:01:44.540253 IP 10.0.0.3.33008 > 10.0.0.2.5001: Flags [.], seq 809487:810935, ack 1, win 502, options [nop,nop,TS val 3617347936 ecr 1338686520], length 1448
2026-05-28 03:01:44.540254 IP 10.0.0.2.5001 > 10.0.0.3.33008: Flags [.], ack 810935, win 9065, options [nop,nop,TS val 1338686532 ecr 3617347936], length 0
2026-05-28 03:01:44.540254 IP 10.0.0.3.33008 > 10.0.0.2.5001: Flags [.], seq 810935:812383, ack 1, win 502, options [nop,nop,TS val 3617347936 ecr 1338686520], length 1448
2026-05-28 03:01:44.540256 IP 10.0.0.2.5001 > 10.0.0.3.33008: Flags [.], ack 812383, win 9088, options [nop,nop,TS val 1338686532 ecr 3617347936], length 0
2026-05-28 03:01:44.540256 IP 10.0.0.3.33008 > 10.0.0.2.5001: Flags [.], seq 812383:813831, ack 1, win 502, options [nop,nop,TS val 3617347936 ecr 1338686520], length 1448
2026-05-28 03:01:44.540257 IP 10.0.0.2.5001 > 10.0.0.3.33008: Flags [.], ack 813831, win 9110, options [nop,nop,TS val 1338686532 ecr 3617347936], length 0
2026-05-28 03:01:44.540258 IP 10.0.0.3.33008 > 10.0.0.2.5001: Flags [.], seq 813831:815279, ack 1, win 502, options [nop,nop,TS val 3617347936 ecr 1338686520], length 1448
2026-05-28 03:01:44.540259 IP 10.0.0.2.5001 > 10.0.0.3.33008: Flags [.], ack 815279, win 9133, options [nop,nop,TS val 1338686532 ecr 3617347936], length 0
2026-05-28 03:01:44.540259 IP 10.0.0.3.33008 > 10.0.0.2.5001: Flags [.], seq 815279:816727, ack 1, win 502, options [nop,nop,TS val 3617347936 ecr 1338686520], length 1448
2026-05-28 03:01:44.540260 IP 10.0.0.2.5001 > 10.0.0.3.33008: Flags [.], ack 816727, win 9156, options [nop,nop,TS val 1338686532 ecr 3617347936], length 0
2026-05-28 03:01:44.540261 IP 10.0.0.3.33008 > 10.0.0.2.5001: Flags [.], seq 816727:818175, ack 1, win 502, options [nop,nop,TS val 3617347936 ecr 1338686520], length 1448
2026-05-28 03:01:44.540261 IP 10.0.0.2.5001 > 10.0.0.3.33008: Flags [.], ack 818175, win 9178, options [nop,nop,TS val 1338686532 ecr 3617347936], length 0
