2026-05-28 03:03:52.697031 IP 10.0.0.3.43808 > 10.0.0.2.5002: UDP, length 39
2026-05-28 03:03:52.697050 IP 10.0.0.3.43808 > 10.0.0.2.5002: UDP, length 1425
2026-05-28 03:03:52.697051 IP 10.0.0.3.43808 > 10.0.0.2.5002: UDP, length 1425
2026-05-28 03:03:52.697051 IP 10.0.0.3.43808 > 10.0.0.2.5002: UDP, length 1425
2026-05-28 03:03:52.697185 IP 10.0.0.2.5002 > 10.0.0.3.43808: UDP, length 25
2026-05-28 03:03:52.697236 IP 10.0.0.2.5002 > 10.0.0.3.43808: UDP, length 25
2026-05-28 03:03:52.697258 IP 10.0.0.2.5002 > 10.0.0.3.43808: UDP, length 25
2026-05-28 03:03:52.697295 IP 10.0.0.2.5002 > 10.0.0.3.43808: UDP, length 25
2026-05-28 03:03:52.709946 IP 10.0.0.3.43808 > 10.0.0.2.5002: UDP, length 1425
2026-05-28 03:03:52.709958 IP 10.0.0.3.43808 > 10.0.0.2.5002: UDP, length 1425
2026-05-28 03:03:52.709961 IP 10.0.0.3.43808 > 10.0.0.2.5002: UDP, length 1425
2026-05-28 03:03:52.709962 IP 10.0.0.3.43808 > 10.0.0.2.5002: UDP, length 1425
2026-05-28 03:03:52.710035 IP 10.0.0.2.5002 > 10.0.0.3.43808: UDP, length 25
2026-05-28 03:03:52.710103 IP 10.0.0.2.5002 > 10.0.0.3.43808: UDP, length 25
2026-05-28 03:03:52.710125 IP 10.0.0.2.5002 > 10.0.0.3.43808: UDP, length 25
2026-05-28 03:03:52.710149 IP 10.0.0.2.5002 > 10.0.0.3.43808: UDP, length 25
2026-05-28 03:03:52.722934 IP 10.0.0.3.43808 > 10.0.0.2.5002: UDP, length 1425
2026-05-28 03:03:52.722944 IP 10.0.0.3.43808 > 10.0.0.2.5002: UDP, length 1425
2026-05-28 03:03:52.722946 IP 10.0.0.3.43808 > 10.0.0.2.5002: UDP, length 1425
2026-05-28 03:03:52.722947 IP 10.0.0.3.43808 > 10.0.0.2.5002: UDP, length 1425
2026-05-28 03:03:52.723005 IP 10.0.0.2.5002 > 10.0.0.3.43808: UDP, length 25
2026-05-28 03:03:52.723059 IP 10.0.0.2.5002 > 10.0.0.3.43808: UDP, length 25
2026-05-28 03:03:52.723084 IP 10.0.0.2.5002 > 10.0.0.3.43808: UDP, length 25
2026-05-28 03:03:52.723105 IP 10.0.0.2.5002 > 10.0.0.3.43808: UDP, length 25
2026-05-28 03:03:52.733650 IP 10.0.0.3.43808 > 10.0.0.2.5002: UDP, length 1425
2026-05-28 03:03:52.733662 IP 10.0.0.3.43808 > 10.0.0.2.5002: UDP, length 1425
2026-05-28 03:03:52.733665 IP 10.0.0.3.43808 > 10.0.0.2.5002: UDP, length 1425
2026-05-28 03:03:52.733665 IP 10.0.0.3.43808 > 10.0.0.2.5002: UDP, length 1425
2026-05-28 03:03:52.733742 IP 10.0.0.2.5002 > 10.0.0.3.43808: UDP, length 25
2026-05-28 03:03:52.733807 IP 10.0.0.2.5002 > 10.0.0.3.43808: UDP, length 25
2026-05-28 03:03:52.733823 IP 10.0.0.2.5002 > 10.0.0.3.43808: UDP, length 25
2026-05-28 03:03:52.733836 IP 10.0.0.2.5002 > 10.0.0.3.43808: UDP, length 25
2026-05-28 03:03:52.746662 IP 10.0.0.3.43808 > 10.0.0.2.5002: UDP, length 1425
2026-05-28 03:03:52.746677 IP 10.0.0.3.43808 > 10.0.0.2.5002: UDP, length 1425
2026-05-28 03:03:52.746678 IP 10.0.0.3.43808 > 10.0.0.2.5002: UDP, length 1425
2026-05-28 03:03:52.746680 IP 10.0.0.3.43808 > 10.0.0.2.5002: UDP, length 1425
2026-05-28 03:03:52.746724 IP 10.0.0.2.5002 > 10.0.0.3.43808: UDP, length 25
2026-05-28 03:03:52.746766 IP 10.0.0.2.5002 > 10.0.0.3.43808: UDP, length 25
2026-05-28 03:03:52.746782 IP 10.0.0.2.5002 > 10.0.0.3.43808: UDP, length 25
2026-05-28 03:03:52.746796 IP 10.0.0.2.5002 > 10.0.0.3.43808: UDP, length 25
2026-05-28 03:03:52.757641 IP 10.0.0.3.43808 > 10.0.0.2.5002: UDP, length 1425
2026-05-28 03:03:52.757648 IP 10.0.0.3.43808 > 10.0.0.2.5002: UDP, length 1425
2026-05-28 03:03:52.757650 IP 10.0.0.3.43808 > 10.0.0.2.5002: UDP, length 1425
2026-05-28 03:03:52.757650 IP 10.0.0.3.43808 > 10.0.0.2.5002: UDP, length 1425
2026-05-28 03:03:52.757713 IP 10.0.0.2.5002 > 10.0.0.3.43808: UDP, length 25
2026-05-28 03:03:52.757777 IP 10.0.0.2.5002 > 10.0.0.3.43808: UDP, length 25
2026-05-28 03:03:52.757801 IP 10.0.0.2.5002 > 10.0.0.3.43808: UDP, length 25
2026-05-28 03:03:52.757832 IP 10.0.0.2.5002 > 10.0.0.3.43808: UDP, length 25
2026-05-28 03:03:52.768653 IP 10.0.0.3.43808 > 10.0.0.2.5002: UDP, length 1425
2026-05-28 03:03:52.768670 IP 10.0.0.3.43808 > 10.0.0.2.5002: UDP, length 1425
2026-05-28 03:03:52.768671 IP 10.0.0.3.43808 > 10.0.0.2.5002: UDP, length 1425
2026-05-28 03:03:52.768672 IP 10.0.0.3.43808 > 10.0.0.2.5002: UDP, length 1425
2026-05-28 03:03:52.768722 IP 10.0.0.2.5002 > 10.0.0.3.43808: UDP, length 25
2026-05-28 03:03:52.768764 IP 10.0.0.2.5002 > 10.0.0.3.43808: UDP, length 25
2026-05-28 03:03:52.768781 IP 10.0.0.2.5002 > 10.0.0.3.43808: UDP, length 25
2026-05-28 03:03:52.768799 IP 10.0.0.2.5002 > 10.0.0.3.43808: UDP, length 25
2026-05-28 03:03:52.781621 IP 10.0.0.3.43808 > 10.0.0.2.5002: UDP, length 1425
2026-05-28 03:03:52.781630 IP 10.0.0.3.43808 > 10.0.0.2.5002: UDP, length 1425
2026-05-28 03:03:52.781631 IP 10.0.0.3.43808 > 10.0.0.2.5002: UDP, length 1425
2026-05-28 03:03:52.781632 IP 10.0.0.3.43808 > 10.0.0.2.5002: UDP, length 1425
2026-05-28 03:03:52.781703 IP 10.0.0.2.5002 > 10.0.0.3.43808: UDP, length 25
2026-05-28 03:03:52.781746 IP 10.0.0.2.5002 > 10.0.0.3.43808: UDP, length 25
2026-05-28 03:03:52.781759 IP 10.0.0.2.5002 > 10.0.0.3.43808: UDP, length 25
2026-05-28 03:03:52.781774 IP 10.0.0.2.5002 > 10.0.0.3.43808: UDP, length 25
2026-05-28 03:03:52.792628 IP 10.0.0.3.43808 > 10.0.0.2.5002: UDP, length 1425
2026-05-28 03:03:52.792636 IP 10.0.0.3.43808 > 10.0.0.2.5002: UDP, length 1425
2026-05-28 03:03:52.792638 IP 10.0.0.3.43808 > 10.0.0.2.5002: UDP, length 1425
2026-05-28 03:03:52.792639 IP 10.0.0.3.43808 > 10.0.0.2.5002: UDP, length 1425
2026-05-28 03:03:52.792688 IP 10.0.0.2.5002 > 10.0.0.3.43808: UDP, length 25
2026-05-28 03:03:52.792739 IP 10.0.0.2.5002 > 10.0.0.3.43808: UDP, length 25
2026-05-28 03:03:52.792755 IP 10.0.0.2.5002 > 10.0.0.3.43808: UDP, length 25
2026-05-28 03:03:52.792774 IP 10.0.0.2.5002 > 10.0.0.3.43808: UDP, length 25
2026-05-28 03:03:52.805929 IP 10.0.0.3.43808 > 10.0.0.2.5002: UDP, length 1425
2026-05-28 03:03:52.805942 IP 10.0.0.3.43808 > 10.0.0.2.5002: UDP, length 1425
2026-05-28 03:03:52.805943 IP 10.0.0.3.43808 > 10.0.0.2.5002: UDP, length 1425
2026-05-28 03:03:52.805944 IP 10.0.0.3.43808 > 10.0.0.2.5002: UDP, length 1425
2026-05-28 03:03:52.805998 IP 10.0.0.2.5002 > 10.0.0.3.43808: UDP, length 25
2026-05-28 03:03:52.806047 IP 10.0.0.2.5002 > 10.0.0.3.43808: UDP, length 25
2026-05-28 03:03:52.806068 IP 10.0.0.2.5002 > 10.0.0.3.43808: UDP, length 25
2026-05-28 03:03:52.806094 IP 10.0.0.2.5002 > 10.0.0.3.43808: UDP, length 25
2026-05-28 03:03:52.818940 IP 10.0.0.3.43808 > 10.0.0.2.5002: UDP, length 1425
2026-05-28 03:03:52.818955 IP 10.0.0.3.43808 > 10.0.0.2.5002: UDP, length 1425
2026-05-28 03:03:52.818957 IP 10.0.0.3.43808 > 10.0.0.2.5002: UDP, length 1425
2026-05-28 03:03:52.818958 IP 10.0.0.3.43808 > 10.0.0.2.5002: UDP, length 1425
2026-05-28 03:03:52.819021 IP 10.0.0.2.5002 > 10.0.0.3.43808: UDP, length 25
2026-05-28 03:03:52.819084 IP 10.0.0.2.5002 > 10.0.0.3.43808: UDP, length 25
2026-05-28 03:03:52.819104 IP 10.0.0.2.5002 > 10.0.0.3.43808: UDP, length 25
2026-05-28 03:03:52.819130 IP 10.0.0.2.5002 > 10.0.0.3.43808: UDP, length 25
2026-05-28 03:03:52.829653 IP 10.0.0.3.43808 > 10.0.0.2.5002: UDP, length 1425
2026-05-28 03:03:52.829666 IP 10.0.0.3.43808 > 10.0.0.2.5002: UDP, length 1425
2026-05-28 03:03:52.829670 IP 10.0.0.3.43808 > 10.0.0.2.5002: UDP, length 1425
2026-05-28 03:03:52.829671 IP 10.0.0.3.43808 > 10.0.0.2.5002: UDP, length 1425
2026-05-28 03:03:52.829728 IP 10.0.0.2.5002 > 10.0.0.3.43808: UDP, length 25
2026-05-28 03:03:52.829782 IP 10.0.0.2.5002 > 10.0.0.3.43808: UDP, length 25
2026-05-28 03:03:52.829806 IP 10.0.0.2.5002 > 10.0.0.3.43808: UDP, length 25
2026-05-28 03:03:52.829824 IP 10.0.0.2.5002 > 10.0.0.3.43808: UDP, length 25
2026-05-28 03:03:52.843067 IP 10.0.0.3.43808 > 10.0.0.2.5002: UDP, length 1425
2026-05-28 03:03:52.843081 IP 10.0.0.3.43808 > 10.0.0.2.5002: UDP, length 1425
2026-05-28 03:03:52.843083 IP 10.0.0.3.43808 > 10.0.0.2.5002: UDP, length 1425
2026-05-28 03:03:52.843084 IP 10.0.0.3.43808 > 10.0.0.2.5002: UDP, length 1425
2026-05-28 03:03:52.843141 IP 10.0.0.2.5002 > 10.0.0.3.43808: UDP, length 25
2026-05-28 03:03:52.843196 IP 10.0.0.2.5002 > 10.0.0.3.43808: UDP, length 25
2026-05-28 03:03:52.843213 IP 10.0.0.2.5002 > 10.0.0.3.43808: UDP, length 25
2026-05-28 03:03:52.843238 IP 10.0.0.2.5002 > 10.0.0.3.43808: UDP, length 25
2026-05-28 03:03:52.854392 IP 10.0.0.3.43808 > 10.0.0.2.5002: UDP, length 1425
2026-05-28 03:03:52.854404 IP 10.0.0.3.43808 > 10.0.0.2.5002: UDP, length 1425
2026-05-28 03:03:52.854405 IP 10.0.0.3.43808 > 10.0.0.2.5002: UDP, length 1425
2026-05-28 03:03:52.854406 IP 10.0.0.3.43808 > 10.0.0.2.5002: UDP, length 1425
2026-05-28 03:03:52.854467 IP 10.0.0.2.5002 > 10.0.0.3.43808: UDP, length 25
2026-05-28 03:03:52.854522 IP 10.0.0.2.5002 > 10.0.0.3.43808: UDP, length 25
2026-05-28 03:03:52.854558 IP 10.0.0.2.5002 > 10.0.0.3.43808: UDP, length 25
2026-05-28 03:03:52.854591 IP 10.0.0.2.5002 > 10.0.0.3.43808: UDP, length 25
2026-05-28 03:03:52.865637 IP 10.0.0.3.43808 > 10.0.0.2.5002: UDP, length 1425
2026-05-28 03:03:52.865646 IP 10.0.0.3.43808 > 10.0.0.2.5002: UDP, length 1425
2026-05-28 03:03:52.865648 IP 10.0.0.3.43808 > 10.0.0.2.5002: UDP, length 1425
2026-05-28 03:03:52.865649 IP 10.0.0.3.43808 > 10.0.0.2.5002: UDP, length 1425
2026-05-28 03:03:52.865721 IP 10.0.0.2.5002 > 10.0.0.3.43808: UDP, length 25
2026-05-28 03:03:52.865795 IP 10.0.0.2.5002 > 10.0.0.3.43808: UDP, length 25
2026-05-28 03:03:52.865818 IP 10.0.0.2.5002 > 10.0.0.3.43808: UDP, length 25
2026-05-28 03:03:52.865845 IP 10.0.0.2.5002 > 10.0.0.3.43808: UDP, length 25
2026-05-28 03:03:52.876647 IP 10.0.0.3.43808 > 10.0.0.2.5002: UDP, length 1425
2026-05-28 03:03:52.876661 IP 10.0.0.3.43808 > 10.0.0.2.5002: UDP, length 1425
2026-05-28 03:03:52.876663 IP 10.0.0.3.43808 > 10.0.0.2.5002: UDP, length 1425
2026-05-28 03:03:52.876664 IP 10.0.0.3.43808 > 10.0.0.2.5002: UDP, length 1425
2026-05-28 03:03:52.876715 IP 10.0.0.2.5002 > 10.0.0.3.43808: UDP, length 25
2026-05-28 03:03:52.876769 IP 10.0.0.2.5002 > 10.0.0.3.43808: UDP, length 25
2026-05-28 03:03:52.876795 IP 10.0.0.2.5002 > 10.0.0.3.43808: UDP, length 25
2026-05-28 03:03:52.876817 IP 10.0.0.2.5002 > 10.0.0.3.43808: UDP, length 25
2026-05-28 03:03:52.890169 IP 10.0.0.3.43808 > 10.0.0.2.5002: UDP, length 1425
2026-05-28 03:03:52.890186 IP 10.0.0.3.43808 > 10.0.0.2.5002: UDP, length 1425
2026-05-28 03:03:52.890188 IP 10.0.0.3.43808 > 10.0.0.2.5002: UDP, length 1425
2026-05-28 03:03:52.890189 IP 10.0.0.3.43808 > 10.0.0.2.5002: UDP, length 1425
2026-05-28 03:03:52.890241 IP 10.0.0.2.5002 > 10.0.0.3.43808: UDP, length 25
2026-05-28 03:03:52.890292 IP 10.0.0.2.5002 > 10.0.0.3.43808: UDP, length 25
2026-05-28 03:03:52.890323 IP 10.0.0.2.5002 > 10.0.0.3.43808: UDP, length 25
2026-05-28 03:03:52.890354 IP 10.0.0.2.5002 > 10.0.0.3.43808: UDP, length 25
2026-05-28 03:03:52.902627 IP 10.0.0.3.43808 > 10.0.0.2.5002: UDP, length 1425
2026-05-28 03:03:52.902637 IP 10.0.0.3.43808 > 10.0.0.2.5002: UDP, length 1425
2026-05-28 03:03:52.902638 IP 10.0.0.3.43808 > 10.0.0.2.5002: UDP, length 1425
2026-05-28 03:03:52.902639 IP 10.0.0.3.43808 > 10.0.0.2.5002: UDP, length 1425
2026-05-28 03:03:52.902697 IP 10.0.0.2.5002 > 10.0.0.3.43808: UDP, length 25
2026-05-28 03:03:52.902766 IP 10.0.0.2.5002 > 10.0.0.3.43808: UDP, length 25
2026-05-28 03:03:52.902800 IP 10.0.0.2.5002 > 10.0.0.3.43808: UDP, length 25
2026-05-28 03:03:52.902830 IP 10.0.0.2.5002 > 10.0.0.3.43808: UDP, length 25
2026-05-28 03:03:52.914388 IP 10.0.0.3.43808 > 10.0.0.2.5002: UDP, length 1425
2026-05-28 03:03:52.914400 IP 10.0.0.3.43808 > 10.0.0.2.5002: UDP, length 1425
2026-05-28 03:03:52.914402 IP 10.0.0.3.43808 > 10.0.0.2.5002: UDP, length 1425
2026-05-28 03:03:52.914403 IP 10.0.0.3.43808 > 10.0.0.2.5002: UDP, length 1425
2026-05-28 03:03:52.914478 IP 10.0.0.2.5002 > 10.0.0.3.43808: UDP, length 25
2026-05-28 03:03:52.914564 IP 10.0.0.2.5002 > 10.0.0.3.43808: UDP, length 25
2026-05-28 03:03:52.914605 IP 10.0.0.2.5002 > 10.0.0.3.43808: UDP, length 25
2026-05-28 03:03:52.914646 IP 10.0.0.2.5002 > 10.0.0.3.43808: UDP, length 25
2026-05-28 03:03:52.926399 IP 10.0.0.3.43808 > 10.0.0.2.5002: UDP, length 1425
2026-05-28 03:03:52.926412 IP 10.0.0.3.43808 > 10.0.0.2.5002: UDP, length 1425
2026-05-28 03:03:52.926415 IP 10.0.0.3.43808 > 10.0.0.2.5002: UDP, length 1425
2026-05-28 03:03:52.926417 IP 10.0.0.3.43808 > 10.0.0.2.5002: UDP, length 1425
2026-05-28 03:03:52.926481 IP 10.0.0.2.5002 > 10.0.0.3.43808: UDP, length 25
2026-05-28 03:03:52.926544 IP 10.0.0.2.5002 > 10.0.0.3.43808: UDP, length 25
2026-05-28 03:03:52.926594 IP 10.0.0.2.5002 > 10.0.0.3.43808: UDP, length 25
2026-05-28 03:03:52.926645 IP 10.0.0.2.5002 > 10.0.0.3.43808: UDP, length 25
2026-05-28 03:03:52.939655 IP 10.0.0.3.43808 > 10.0.0.2.5002: UDP, length 1425
2026-05-28 03:03:52.939704 IP 10.0.0.3.43808 > 10.0.0.2.5002: UDP, length 1425
2026-05-28 03:03:52.939713 IP 10.0.0.3.43808 > 10.0.0.2.5002: UDP, length 1425
2026-05-28 03:03:52.939715 IP 10.0.0.3.43808 > 10.0.0.2.5002: UDP, length 1425
2026-05-28 03:03:52.939938 IP 10.0.0.2.5002 > 10.0.0.3.43808: UDP, length 25
2026-05-28 03:03:52.940171 IP 10.0.0.2.5002 > 10.0.0.3.43808: UDP, length 25
2026-05-28 03:03:52.940249 IP 10.0.0.2.5002 > 10.0.0.3.43808: UDP, length 25
2026-05-28 03:03:52.940320 IP 10.0.0.2.5002 > 10.0.0.3.43808: UDP, length 25
2026-05-28 03:03:52.951664 IP 10.0.0.3.43808 > 10.0.0.2.5002: UDP, length 1425
2026-05-28 03:03:52.951693 IP 10.0.0.3.43808 > 10.0.0.2.5002: UDP, length 1425
2026-05-28 03:03:52.951698 IP 10.0.0.3.43808 > 10.0.0.2.5002: UDP, length 1425
2026-05-28 03:03:52.951700 IP 10.0.0.3.43808 > 10.0.0.2.5002: UDP, length 1425
2026-05-28 03:03:52.951834 IP 10.0.0.2.5002 > 10.0.0.3.43808: UDP, length 25
2026-05-28 03:03:52.951981 IP 10.0.0.2.5002 > 10.0.0.3.43808: UDP, length 25
2026-05-28 03:03:52.952021 IP 10.0.0.2.5002 > 10.0.0.3.43808: UDP, length 25
2026-05-28 03:03:52.952113 IP 10.0.0.2.5002 > 10.0.0.3.43808: UDP, length 25
2026-05-28 03:03:52.962657 IP 10.0.0.3.43808 > 10.0.0.2.5002: UDP, length 1425
2026-05-28 03:03:52.962676 IP 10.0.0.3.43808 > 10.0.0.2.5002: UDP, length 1425
2026-05-28 03:03:52.962680 IP 10.0.0.3.43808 > 10.0.0.2.5002: UDP, length 1425
2026-05-28 03:03:52.962682 IP 10.0.0.3.43808 > 10.0.0.2.5002: UDP, length 1425
2026-05-28 03:03:52.962770 IP 10.0.0.2.5002 > 10.0.0.3.43808: UDP, length 25
2026-05-28 03:03:52.962880 IP 10.0.0.2.5002 > 10.0.0.3.43808: UDP, length 25
2026-05-28 03:03:52.962914 IP 10.0.0.2.5002 > 10.0.0.3.43808: UDP, length 25
2026-05-28 03:03:52.962940 IP 10.0.0.2.5002 > 10.0.0.3.43808: UDP, length 25
2026-05-28 03:03:52.976140 IP 10.0.0.3.43808 > 10.0.0.2.5002: UDP, length 1425
2026-05-28 03:03:52.976187 IP 10.0.0.3.43808 > 10.0.0.2.5002: UDP, length 1425
2026-05-28 03:03:52.976194 IP 10.0.0.3.43808 > 10.0.0.2.5002: UDP, length 1425
2026-05-28 03:03:52.976195 IP 10.0.0.3.43808 > 10.0.0.2.5002: UDP, length 1425
2026-05-28 03:03:52.976465 IP 10.0.0.2.5002 > 10.0.0.3.43808: UDP, length 25
2026-05-28 03:03:52.976716 IP 10.0.0.2.5002 > 10.0.0.3.43808: UDP, length 25
2026-05-28 03:03:52.976794 IP 10.0.0.2.5002 > 10.0.0.3.43808: UDP, length 25
2026-05-28 03:03:52.976879 IP 10.0.0.2.5002 > 10.0.0.3.43808: UDP, length 25
2026-05-28 03:03:52.989558 IP 10.0.0.3.43808 > 10.0.0.2.5002: UDP, length 1425
2026-05-28 03:03:52.989572 IP 10.0.0.3.43808 > 10.0.0.2.5002: UDP, length 1425
2026-05-28 03:03:52.989574 IP 10.0.0.3.43808 > 10.0.0.2.5002: UDP, length 1425
2026-05-28 03:03:52.989575 IP 10.0.0.3.43808 > 10.0.0.2.5002: UDP, length 1425
2026-05-28 03:03:52.989647 IP 10.0.0.2.5002 > 10.0.0.3.43808: UDP, length 25
2026-05-28 03:03:52.989723 IP 10.0.0.2.5002 > 10.0.0.3.43808: UDP, length 25
2026-05-28 03:03:52.989864 IP 10.0.0.2.5002 > 10.0.0.3.43808: UDP, length 25
2026-05-28 03:03:52.990023 IP 10.0.0.2.5002 > 10.0.0.3.43808: UDP, length 25
2026-05-28 03:03:53.002931 IP 10.0.0.3.43808 > 10.0.0.2.5002: UDP, length 1425
2026-05-28 03:03:53.002946 IP 10.0.0.3.43808 > 10.0.0.2.5002: UDP, length 1425
2026-05-28 03:03:53.002948 IP 10.0.0.3.43808 > 10.0.0.2.5002: UDP, length 1425
2026-05-28 03:03:53.002950 IP 10.0.0.3.43808 > 10.0.0.2.5002: UDP, length 1425
2026-05-28 03:03:53.003026 IP 10.0.0.2.5002 > 10.0.0.3.43808: UDP, length 25
2026-05-28 03:03:53.003112 IP 10.0.0.2.5002 > 10.0.0.3.43808: UDP, length 25
2026-05-28 03:03:53.003138 IP 10.0.0.2.5002 > 10.0.0.3.43808: UDP, length 25
2026-05-28 03:03:53.003178 IP 10.0.0.2.5002 > 10.0.0.3.43808: UDP, length 25
2026-05-28 03:03:53.014615 IP 10.0.0.3.43808 > 10.0.0.2.5002: UDP, length 1425
2026-05-28 03:03:53.014623 IP 10.0.0.3.43808 > 10.0.0.2.5002: UDP, length 1425
2026-05-28 03:03:53.014626 IP 10.0.0.3.43808 > 10.0.0.2.5002: UDP, length 1425
2026-05-28 03:03:53.014627 IP 10.0.0.3.43808 > 10.0.0.2.5002: UDP, length 1425
2026-05-28 03:03:53.014663 IP 10.0.0.2.5002 > 10.0.0.3.43808: UDP, length 25
2026-05-28 03:03:53.014730 IP 10.0.0.2.5002 > 10.0.0.3.43808: UDP, length 25
2026-05-28 03:03:53.014822 IP 10.0.0.2.5002 > 10.0.0.3.43808: UDP, length 25
2026-05-28 03:03:53.014850 IP 10.0.0.2.5002 > 10.0.0.3.43808: UDP, length 25
2026-05-28 03:03:53.028068 IP 10.0.0.3.43808 > 10.0.0.2.5002: UDP, length 1425
2026-05-28 03:03:53.028082 IP 10.0.0.3.43808 > 10.0.0.2.5002: UDP, length 1425
2026-05-28 03:03:53.028087 IP 10.0.0.3.43808 > 10.0.0.2.5002: UDP, length 1425
2026-05-28 03:03:53.028088 IP 10.0.0.3.43808 > 10.0.0.2.5002: UDP, length 1425
2026-05-28 03:03:53.028158 IP 10.0.0.2.5002 > 10.0.0.3.43808: UDP, length 25
2026-05-28 03:03:53.028227 IP 10.0.0.2.5002 > 10.0.0.3.43808: UDP, length 25
2026-05-28 03:03:53.028256 IP 10.0.0.2.5002 > 10.0.0.3.43808: UDP, length 25
2026-05-28 03:03:53.028299 IP 10.0.0.2.5002 > 10.0.0.3.43808: UDP, length 25
2026-05-28 03:03:53.038648 IP 10.0.0.3.43808 > 10.0.0.2.5002: UDP, length 1425
2026-05-28 03:03:53.038660 IP 10.0.0.3.43808 > 10.0.0.2.5002: UDP, length 1425
2026-05-28 03:03:53.038661 IP 10.0.0.3.43808 > 10.0.0.2.5002: UDP, length 1425
2026-05-28 03:03:53.038663 IP 10.0.0.3.43808 > 10.0.0.2.5002: UDP, length 1425
2026-05-28 03:03:53.038724 IP 10.0.0.2.5002 > 10.0.0.3.43808: UDP, length 25
2026-05-28 03:03:53.038789 IP 10.0.0.2.5002 > 10.0.0.3.43808: UDP, length 25
2026-05-28 03:03:53.038817 IP 10.0.0.2.5002 > 10.0.0.3.43808: UDP, length 25
2026-05-28 03:03:53.038858 IP 10.0.0.2.5002 > 10.0.0.3.43808: UDP, length 25
2026-05-28 03:03:53.051619 IP 10.0.0.3.43808 > 10.0.0.2.5002: UDP, length 1425
2026-05-28 03:03:53.051633 IP 10.0.0.3.43808 > 10.0.0.2.5002: UDP, length 1425
2026-05-28 03:03:53.051635 IP 10.0.0.3.43808 > 10.0.0.2.5002: UDP, length 1425
2026-05-28 03:03:53.051636 IP 10.0.0.3.43808 > 10.0.0.2.5002: UDP, length 1425
2026-05-28 03:03:53.051701 IP 10.0.0.2.5002 > 10.0.0.3.43808: UDP, length 25
2026-05-28 03:03:53.051774 IP 10.0.0.2.5002 > 10.0.0.3.43808: UDP, length 25
2026-05-28 03:03:53.051811 IP 10.0.0.2.5002 > 10.0.0.3.43808: UDP, length 25
2026-05-28 03:03:53.051851 IP 10.0.0.2.5002 > 10.0.0.3.43808: UDP, length 25
2026-05-28 03:03:53.064857 IP 10.0.0.3.43808 > 10.0.0.2.5002: UDP, length 1425
2026-05-28 03:03:53.064869 IP 10.0.0.3.43808 > 10.0.0.2.5002: UDP, length 1425
2026-05-28 03:03:53.064871 IP 10.0.0.3.43808 > 10.0.0.2.5002: UDP, length 1425
2026-05-28 03:03:53.064872 IP 10.0.0.3.43808 > 10.0.0.2.5002: UDP, length 1425
2026-05-28 03:03:53.064934 IP 10.0.0.2.5002 > 10.0.0.3.43808: UDP, length 25
2026-05-28 03:03:53.065004 IP 10.0.0.2.5002 > 10.0.0.3.43808: UDP, length 25
2026-05-28 03:03:53.065156 IP 10.0.0.2.5002 > 10.0.0.3.43808: UDP, length 25
2026-05-28 03:03:53.065531 IP 10.0.0.2.5002 > 10.0.0.3.43808: UDP, length 25
2026-05-28 03:03:53.076665 IP 10.0.0.3.43808 > 10.0.0.2.5002: UDP, length 1425
2026-05-28 03:03:53.076676 IP 10.0.0.3.43808 > 10.0.0.2.5002: UDP, length 1425
2026-05-28 03:03:53.076678 IP 10.0.0.3.43808 > 10.0.0.2.5002: UDP, length 1425
2026-05-28 03:03:53.076679 IP 10.0.0.3.43808 > 10.0.0.2.5002: UDP, length 1425
2026-05-28 03:03:53.076740 IP 10.0.0.2.5002 > 10.0.0.3.43808: UDP, length 25
2026-05-28 03:03:53.076803 IP 10.0.0.2.5002 > 10.0.0.3.43808: UDP, length 25
2026-05-28 03:03:53.076829 IP 10.0.0.2.5002 > 10.0.0.3.43808: UDP, length 25
2026-05-28 03:03:53.076856 IP 10.0.0.2.5002 > 10.0.0.3.43808: UDP, length 25
2026-05-28 03:03:53.090204 IP 10.0.0.3.43808 > 10.0.0.2.5002: UDP, length 1425
2026-05-28 03:03:53.090283 IP 10.0.0.3.43808 > 10.0.0.2.5002: UDP, length 1425
2026-05-28 03:03:53.090293 IP 10.0.0.3.43808 > 10.0.0.2.5002: UDP, length 1425
2026-05-28 03:03:53.090295 IP 10.0.0.3.43808 > 10.0.0.2.5002: UDP, length 1425
2026-05-28 03:03:53.090561 IP 10.0.0.2.5002 > 10.0.0.3.43808: UDP, length 25
2026-05-28 03:03:53.090784 IP 10.0.0.2.5002 > 10.0.0.3.43808: UDP, length 25
2026-05-28 03:03:53.090851 IP 10.0.0.2.5002 > 10.0.0.3.43808: UDP, length 25
2026-05-28 03:03:53.090922 IP 10.0.0.2.5002 > 10.0.0.3.43808: UDP, length 25
2026-05-28 03:03:53.101674 IP 10.0.0.3.43808 > 10.0.0.2.5002: UDP, length 1425
2026-05-28 03:03:53.101704 IP 10.0.0.3.43808 > 10.0.0.2.5002: UDP, length 1425
2026-05-28 03:03:53.101711 IP 10.0.0.3.43808 > 10.0.0.2.5002: UDP, length 1425
2026-05-28 03:03:53.101712 IP 10.0.0.3.43808 > 10.0.0.2.5002: UDP, length 1425
2026-05-28 03:03:53.101876 IP 10.0.0.2.5002 > 10.0.0.3.43808: UDP, length 25
2026-05-28 03:03:53.102056 IP 10.0.0.2.5002 > 10.0.0.3.43808: UDP, length 25
2026-05-28 03:03:53.102091 IP 10.0.0.2.5002 > 10.0.0.3.43808: UDP, length 25
2026-05-28 03:03:53.102122 IP 10.0.0.2.5002 > 10.0.0.3.43808: UDP, length 25
2026-05-28 03:03:53.114070 IP 10.0.0.3.43808 > 10.0.0.2.5002: UDP, length 1425
2026-05-28 03:03:53.114088 IP 10.0.0.3.43808 > 10.0.0.2.5002: UDP, length 1425
2026-05-28 03:03:53.114092 IP 10.0.0.3.43808 > 10.0.0.2.5002: UDP, length 1425
2026-05-28 03:03:53.114093 IP 10.0.0.3.43808 > 10.0.0.2.5002: UDP, length 1425
2026-05-28 03:03:53.114183 IP 10.0.0.2.5002 > 10.0.0.3.43808: UDP, length 25
2026-05-28 03:03:53.114263 IP 10.0.0.2.5002 > 10.0.0.3.43808: UDP, length 25
2026-05-28 03:03:53.114297 IP 10.0.0.2.5002 > 10.0.0.3.43808: UDP, length 25
2026-05-28 03:03:53.114328 IP 10.0.0.2.5002 > 10.0.0.3.43808: UDP, length 25
2026-05-28 03:03:53.126388 IP 10.0.0.3.43808 > 10.0.0.2.5002: UDP, length 1425
2026-05-28 03:03:53.126404 IP 10.0.0.3.43808 > 10.0.0.2.5002: UDP, length 1425
2026-05-28 03:03:53.126407 IP 10.0.0.3.43808 > 10.0.0.2.5002: UDP, length 1425
2026-05-28 03:03:53.126408 IP 10.0.0.3.43808 > 10.0.0.2.5002: UDP, length 1425
2026-05-28 03:03:53.126484 IP 10.0.0.2.5002 > 10.0.0.3.43808: UDP, length 25
2026-05-28 03:03:53.126561 IP 10.0.0.2.5002 > 10.0.0.3.43808: UDP, length 25
2026-05-28 03:03:53.126587 IP 10.0.0.2.5002 > 10.0.0.3.43808: UDP, length 25
2026-05-28 03:03:53.126630 IP 10.0.0.2.5002 > 10.0.0.3.43808: UDP, length 25
2026-05-28 03:03:53.139544 IP 10.0.0.3.43808 > 10.0.0.2.5002: UDP, length 1425
2026-05-28 03:03:53.139556 IP 10.0.0.3.43808 > 10.0.0.2.5002: UDP, length 1425
2026-05-28 03:03:53.139559 IP 10.0.0.3.43808 > 10.0.0.2.5002: UDP, length 1425
2026-05-28 03:03:53.139560 IP 10.0.0.3.43808 > 10.0.0.2.5002: UDP, length 1425
2026-05-28 03:03:53.139626 IP 10.0.0.2.5002 > 10.0.0.3.43808: UDP, length 25
2026-05-28 03:03:53.139732 IP 10.0.0.2.5002 > 10.0.0.3.43808: UDP, length 25
2026-05-28 03:03:53.139785 IP 10.0.0.2.5002 > 10.0.0.3.43808: UDP, length 25
2026-05-28 03:03:53.139812 IP 10.0.0.2.5002 > 10.0.0.3.43808: UDP, length 25
2026-05-28 03:03:53.150704 IP 10.0.0.3.43808 > 10.0.0.2.5002: UDP, length 1425
2026-05-28 03:03:53.150749 IP 10.0.0.3.43808 > 10.0.0.2.5002: UDP, length 1425
2026-05-28 03:03:53.150754 IP 10.0.0.3.43808 > 10.0.0.2.5002: UDP, length 1425
2026-05-28 03:03:53.150755 IP 10.0.0.3.43808 > 10.0.0.2.5002: UDP, length 1425
2026-05-28 03:03:53.151108 IP 10.0.0.2.5002 > 10.0.0.3.43808: UDP, length 25
2026-05-28 03:03:53.151350 IP 10.0.0.2.5002 > 10.0.0.3.43808: UDP, length 25
2026-05-28 03:03:53.151439 IP 10.0.0.2.5002 > 10.0.0.3.43808: UDP, length 25
2026-05-28 03:03:53.151490 IP 10.0.0.2.5002 > 10.0.0.3.43808: UDP, length 25
2026-05-28 03:03:53.163778 IP 10.0.0.3.43808 > 10.0.0.2.5002: UDP, length 1425
2026-05-28 03:03:53.163841 IP 10.0.0.3.43808 > 10.0.0.2.5002: UDP, length 1425
2026-05-28 03:03:53.163849 IP 10.0.0.3.43808 > 10.0.0.2.5002: UDP, length 1425
2026-05-28 03:03:53.163850 IP 10.0.0.3.43808 > 10.0.0.2.5002: UDP, length 1425
2026-05-28 03:03:53.163993 IP 10.0.0.2.5002 > 10.0.0.3.43808: UDP, length 25
2026-05-28 03:03:53.164149 IP 10.0.0.2.5002 > 10.0.0.3.43808: UDP, length 25
2026-05-28 03:03:53.164188 IP 10.0.0.2.5002 > 10.0.0.3.43808: UDP, length 25
2026-05-28 03:03:53.164281 IP 10.0.0.2.5002 > 10.0.0.3.43808: UDP, length 25
2026-05-28 03:03:53.175080 IP 10.0.0.3.43808 > 10.0.0.2.5002: UDP, length 1425
2026-05-28 03:03:53.175093 IP 10.0.0.3.43808 > 10.0.0.2.5002: UDP, length 1425
2026-05-28 03:03:53.175096 IP 10.0.0.3.43808 > 10.0.0.2.5002: UDP, length 1425
2026-05-28 03:03:53.175098 IP 10.0.0.3.43808 > 10.0.0.2.5002: UDP, length 1425
2026-05-28 03:03:53.175171 IP 10.0.0.2.5002 > 10.0.0.3.43808: UDP, length 25
2026-05-28 03:03:53.175258 IP 10.0.0.2.5002 > 10.0.0.3.43808: UDP, length 25
2026-05-28 03:03:53.175299 IP 10.0.0.2.5002 > 10.0.0.3.43808: UDP, length 25
2026-05-28 03:03:53.175341 IP 10.0.0.2.5002 > 10.0.0.3.43808: UDP, length 25
2026-05-28 03:03:53.185649 IP 10.0.0.3.43808 > 10.0.0.2.5002: UDP, length 1425
2026-05-28 03:03:53.185661 IP 10.0.0.3.43808 > 10.0.0.2.5002: UDP, length 1425
2026-05-28 03:03:53.185664 IP 10.0.0.3.43808 > 10.0.0.2.5002: UDP, length 1425
2026-05-28 03:03:53.185665 IP 10.0.0.3.43808 > 10.0.0.2.5002: UDP, length 1425
2026-05-28 03:03:53.185722 IP 10.0.0.2.5002 > 10.0.0.3.43808: UDP, length 25
2026-05-28 03:03:53.185780 IP 10.0.0.2.5002 > 10.0.0.3.43808: UDP, length 25
2026-05-28 03:03:53.185812 IP 10.0.0.2.5002 > 10.0.0.3.43808: UDP, length 25
2026-05-28 03:03:53.185851 IP 10.0.0.2.5002 > 10.0.0.3.43808: UDP, length 25
2026-05-28 03:03:53.196645 IP 10.0.0.3.43808 > 10.0.0.2.5002: UDP, length 1425
2026-05-28 03:03:53.196660 IP 10.0.0.3.43808 > 10.0.0.2.5002: UDP, length 1425
2026-05-28 03:03:53.196663 IP 10.0.0.3.43808 > 10.0.0.2.5002: UDP, length 1425
2026-05-28 03:03:53.196664 IP 10.0.0.3.43808 > 10.0.0.2.5002: UDP, length 1425
2026-05-28 03:03:53.196738 IP 10.0.0.2.5002 > 10.0.0.3.43808: UDP, length 25
2026-05-28 03:03:53.196808 IP 10.0.0.2.5002 > 10.0.0.3.43808: UDP, length 25
2026-05-28 03:03:53.196828 IP 10.0.0.2.5002 > 10.0.0.3.43808: UDP, length 25
2026-05-28 03:03:53.196849 IP 10.0.0.2.5002 > 10.0.0.3.43808: UDP, length 25
2026-05-28 03:03:53.209940 IP 10.0.0.3.43808 > 10.0.0.2.5002: UDP, length 1425
2026-05-28 03:03:53.209950 IP 10.0.0.3.43808 > 10.0.0.2.5002: UDP, length 1425
2026-05-28 03:03:53.209952 IP 10.0.0.3.43808 > 10.0.0.2.5002: UDP, length 1425
2026-05-28 03:03:53.209953 IP 10.0.0.3.43808 > 10.0.0.2.5002: UDP, length 1425
2026-05-28 03:03:53.210009 IP 10.0.0.2.5002 > 10.0.0.3.43808: UDP, length 25
2026-05-28 03:03:53.210068 IP 10.0.0.2.5002 > 10.0.0.3.43808: UDP, length 25
2026-05-28 03:03:53.210085 IP 10.0.0.2.5002 > 10.0.0.3.43808: UDP, length 25
2026-05-28 03:03:53.210112 IP 10.0.0.2.5002 > 10.0.0.3.43808: UDP, length 25
2026-05-28 03:03:53.222649 IP 10.0.0.3.43808 > 10.0.0.2.5002: UDP, length 1425
2026-05-28 03:03:53.222660 IP 10.0.0.3.43808 > 10.0.0.2.5002: UDP, length 1425
2026-05-28 03:03:53.222662 IP 10.0.0.3.43808 > 10.0.0.2.5002: UDP, length 1425
2026-05-28 03:03:53.222663 IP 10.0.0.3.43808 > 10.0.0.2.5002: UDP, length 1425
2026-05-28 03:03:53.222717 IP 10.0.0.2.5002 > 10.0.0.3.43808: UDP, length 25
2026-05-28 03:03:53.222767 IP 10.0.0.2.5002 > 10.0.0.3.43808: UDP, length 25
2026-05-28 03:03:53.222785 IP 10.0.0.2.5002 > 10.0.0.3.43808: UDP, length 25
2026-05-28 03:03:53.222850 IP 10.0.0.2.5002 > 10.0.0.3.43808: UDP, length 25
2026-05-28 03:03:53.234924 IP 10.0.0.3.43808 > 10.0.0.2.5002: UDP, length 1425
2026-05-28 03:03:53.234936 IP 10.0.0.3.43808 > 10.0.0.2.5002: UDP, length 1425
2026-05-28 03:03:53.234938 IP 10.0.0.3.43808 > 10.0.0.2.5002: UDP, length 1425
2026-05-28 03:03:53.234939 IP 10.0.0.3.43808 > 10.0.0.2.5002: UDP, length 1425
2026-05-28 03:03:53.234998 IP 10.0.0.2.5002 > 10.0.0.3.43808: UDP, length 25
2026-05-28 03:03:53.235060 IP 10.0.0.2.5002 > 10.0.0.3.43808: UDP, length 25
2026-05-28 03:03:53.235096 IP 10.0.0.2.5002 > 10.0.0.3.43808: UDP, length 25
2026-05-28 03:03:53.235125 IP 10.0.0.2.5002 > 10.0.0.3.43808: UDP, length 25
2026-05-28 03:03:53.247647 IP 10.0.0.3.43808 > 10.0.0.2.5002: UDP, length 1425
2026-05-28 03:03:53.247661 IP 10.0.0.3.43808 > 10.0.0.2.5002: UDP, length 1425
2026-05-28 03:03:53.247663 IP 10.0.0.3.43808 > 10.0.0.2.5002: UDP, length 1425
2026-05-28 03:03:53.247665 IP 10.0.0.3.43808 > 10.0.0.2.5002: UDP, length 1425
2026-05-28 03:03:53.247731 IP 10.0.0.2.5002 > 10.0.0.3.43808: UDP, length 25
2026-05-28 03:03:53.247858 IP 10.0.0.2.5002 > 10.0.0.3.43808: UDP, length 25
2026-05-28 03:03:53.247912 IP 10.0.0.2.5002 > 10.0.0.3.43808: UDP, length 25
2026-05-28 03:03:53.247938 IP 10.0.0.2.5002 > 10.0.0.3.43808: UDP, length 25
2026-05-28 03:03:53.258656 IP 10.0.0.3.43808 > 10.0.0.2.5002: UDP, length 1425
2026-05-28 03:03:53.258669 IP 10.0.0.3.43808 > 10.0.0.2.5002: UDP, length 1425
2026-05-28 03:03:53.258672 IP 10.0.0.3.43808 > 10.0.0.2.5002: UDP, length 1425
2026-05-28 03:03:53.258672 IP 10.0.0.3.43808 > 10.0.0.2.5002: UDP, length 1425
2026-05-28 03:03:53.258737 IP 10.0.0.2.5002 > 10.0.0.3.43808: UDP, length 25
2026-05-28 03:03:53.258805 IP 10.0.0.2.5002 > 10.0.0.3.43808: UDP, length 25
2026-05-28 03:03:53.258838 IP 10.0.0.2.5002 > 10.0.0.3.43808: UDP, length 25
2026-05-28 03:03:53.258881 IP 10.0.0.2.5002 > 10.0.0.3.43808: UDP, length 25
2026-05-28 03:03:53.272050 IP 10.0.0.3.43808 > 10.0.0.2.5002: UDP, length 1425
2026-05-28 03:03:53.272104 IP 10.0.0.3.43808 > 10.0.0.2.5002: UDP, length 1425
2026-05-28 03:03:53.272111 IP 10.0.0.3.43808 > 10.0.0.2.5002: UDP, length 1425
2026-05-28 03:03:53.272113 IP 10.0.0.3.43808 > 10.0.0.2.5002: UDP, length 1425
2026-05-28 03:03:53.272342 IP 10.0.0.2.5002 > 10.0.0.3.43808: UDP, length 25
2026-05-28 03:03:53.272616 IP 10.0.0.2.5002 > 10.0.0.3.43808: UDP, length 25
2026-05-28 03:03:53.272711 IP 10.0.0.2.5002 > 10.0.0.3.43808: UDP, length 25
2026-05-28 03:03:53.272929 IP 10.0.0.2.5002 > 10.0.0.3.43808: UDP, length 25
2026-05-28 03:03:53.284974 IP 10.0.0.3.43808 > 10.0.0.2.5002: UDP, length 1425
2026-05-28 03:03:53.285003 IP 10.0.0.3.43808 > 10.0.0.2.5002: UDP, length 1425
2026-05-28 03:03:53.285007 IP 10.0.0.3.43808 > 10.0.0.2.5002: UDP, length 1425
2026-05-28 03:03:53.285008 IP 10.0.0.3.43808 > 10.0.0.2.5002: UDP, length 1425
2026-05-28 03:03:53.285150 IP 10.0.0.2.5002 > 10.0.0.3.43808: UDP, length 25
2026-05-28 03:03:53.285301 IP 10.0.0.2.5002 > 10.0.0.3.43808: UDP, length 25
2026-05-28 03:03:53.285353 IP 10.0.0.2.5002 > 10.0.0.3.43808: UDP, length 25
2026-05-28 03:03:53.285399 IP 10.0.0.2.5002 > 10.0.0.3.43808: UDP, length 25
2026-05-28 03:03:53.297693 IP 10.0.0.3.43808 > 10.0.0.2.5002: UDP, length 1425
2026-05-28 03:03:53.297708 IP 10.0.0.3.43808 > 10.0.0.2.5002: UDP, length 1425
2026-05-28 03:03:53.297711 IP 10.0.0.3.43808 > 10.0.0.2.5002: UDP, length 1425
2026-05-28 03:03:53.297712 IP 10.0.0.3.43808 > 10.0.0.2.5002: UDP, length 1425
2026-05-28 03:03:53.297787 IP 10.0.0.2.5002 > 10.0.0.3.43808: UDP, length 25
2026-05-28 03:03:53.297862 IP 10.0.0.2.5002 > 10.0.0.3.43808: UDP, length 25
2026-05-28 03:03:53.297899 IP 10.0.0.2.5002 > 10.0.0.3.43808: UDP, length 25
2026-05-28 03:03:53.297932 IP 10.0.0.2.5002 > 10.0.0.3.43808: UDP, length 25
2026-05-28 03:03:53.310920 IP 10.0.0.3.43808 > 10.0.0.2.5002: UDP, length 1425
2026-05-28 03:03:53.310932 IP 10.0.0.3.43808 > 10.0.0.2.5002: UDP, length 1425
2026-05-28 03:03:53.310935 IP 10.0.0.3.43808 > 10.0.0.2.5002: UDP, length 1425
2026-05-28 03:03:53.310936 IP 10.0.0.3.43808 > 10.0.0.2.5002: UDP, length 1425
2026-05-28 03:03:53.311005 IP 10.0.0.2.5002 > 10.0.0.3.43808: UDP, length 25
2026-05-28 03:03:53.311084 IP 10.0.0.2.5002 > 10.0.0.3.43808: UDP, length 25
2026-05-28 03:03:53.311121 IP 10.0.0.2.5002 > 10.0.0.3.43808: UDP, length 25
2026-05-28 03:03:53.311151 IP 10.0.0.2.5002 > 10.0.0.3.43808: UDP, length 25
2026-05-28 03:03:53.323038 IP 10.0.0.3.43808 > 10.0.0.2.5002: UDP, length 1425
2026-05-28 03:03:53.323093 IP 10.0.0.3.43808 > 10.0.0.2.5002: UDP, length 1425
2026-05-28 03:03:53.323102 IP 10.0.0.3.43808 > 10.0.0.2.5002: UDP, length 1425
2026-05-28 03:03:53.323104 IP 10.0.0.3.43808 > 10.0.0.2.5002: UDP, length 1425
2026-05-28 03:03:53.323344 IP 10.0.0.2.5002 > 10.0.0.3.43808: UDP, length 25
2026-05-28 03:03:53.323611 IP 10.0.0.2.5002 > 10.0.0.3.43808: UDP, length 25
2026-05-28 03:03:53.323670 IP 10.0.0.2.5002 > 10.0.0.3.43808: UDP, length 25
2026-05-28 03:03:53.323753 IP 10.0.0.2.5002 > 10.0.0.3.43808: UDP, length 25
2026-05-28 03:03:53.336588 IP 10.0.0.3.43808 > 10.0.0.2.5002: UDP, length 1425
2026-05-28 03:03:53.336601 IP 10.0.0.3.43808 > 10.0.0.2.5002: UDP, length 1425
2026-05-28 03:03:53.336604 IP 10.0.0.3.43808 > 10.0.0.2.5002: UDP, length 1425
2026-05-28 03:03:53.336605 IP 10.0.0.3.43808 > 10.0.0.2.5002: UDP, length 1425
2026-05-28 03:03:53.336673 IP 10.0.0.2.5002 > 10.0.0.3.43808: UDP, length 25
2026-05-28 03:03:53.336741 IP 10.0.0.2.5002 > 10.0.0.3.43808: UDP, length 25
2026-05-28 03:03:53.336769 IP 10.0.0.2.5002 > 10.0.0.3.43808: UDP, length 25
2026-05-28 03:03:53.336803 IP 10.0.0.2.5002 > 10.0.0.3.43808: UDP, length 25
2026-05-28 03:03:53.349069 IP 10.0.0.3.43808 > 10.0.0.2.5002: UDP, length 1425
2026-05-28 03:03:53.349080 IP 10.0.0.3.43808 > 10.0.0.2.5002: UDP, length 1425
2026-05-28 03:03:53.349082 IP 10.0.0.3.43808 > 10.0.0.2.5002: UDP, length 1425
2026-05-28 03:03:53.349084 IP 10.0.0.3.43808 > 10.0.0.2.5002: UDP, length 1425
2026-05-28 03:03:53.349157 IP 10.0.0.2.5002 > 10.0.0.3.43808: UDP, length 25
2026-05-28 03:03:53.349231 IP 10.0.0.2.5002 > 10.0.0.3.43808: UDP, length 25
2026-05-28 03:03:53.349256 IP 10.0.0.2.5002 > 10.0.0.3.43808: UDP, length 25
2026-05-28 03:03:53.349297 IP 10.0.0.2.5002 > 10.0.0.3.43808: UDP, length 25
2026-05-28 03:03:53.361920 IP 10.0.0.3.43808 > 10.0.0.2.5002: UDP, length 1425
2026-05-28 03:03:53.361936 IP 10.0.0.3.43808 > 10.0.0.2.5002: UDP, length 1425
2026-05-28 03:03:53.361938 IP 10.0.0.3.43808 > 10.0.0.2.5002: UDP, length 1425
2026-05-28 03:03:53.361940 IP 10.0.0.3.43808 > 10.0.0.2.5002: UDP, length 1425
2026-05-28 03:03:53.362001 IP 10.0.0.2.5002 > 10.0.0.3.43808: UDP, length 25
2026-05-28 03:03:53.362067 IP 10.0.0.2.5002 > 10.0.0.3.43808: UDP, length 25
2026-05-28 03:03:53.362090 IP 10.0.0.2.5002 > 10.0.0.3.43808: UDP, length 25
2026-05-28 03:03:53.362120 IP 10.0.0.2.5002 > 10.0.0.3.43808: UDP, length 25
2026-05-28 03:03:53.375059 IP 10.0.0.3.43808 > 10.0.0.2.5002: UDP, length 1425
2026-05-28 03:03:53.375110 IP 10.0.0.3.43808 > 10.0.0.2.5002: UDP, length 1425
2026-05-28 03:03:53.375120 IP 10.0.0.3.43808 > 10.0.0.2.5002: UDP, length 1425
2026-05-28 03:03:53.375122 IP 10.0.0.3.43808 > 10.0.0.2.5002: UDP, length 1425
2026-05-28 03:03:53.375376 IP 10.0.0.2.5002 > 10.0.0.3.43808: UDP, length 25
2026-05-28 03:03:53.375702 IP 10.0.0.2.5002 > 10.0.0.3.43808: UDP, length 25
2026-05-28 03:03:53.375874 IP 10.0.0.2.5002 > 10.0.0.3.43808: UDP, length 25
2026-05-28 03:03:53.375955 IP 10.0.0.2.5002 > 10.0.0.3.43808: UDP, length 25
2026-05-28 03:03:53.386700 IP 10.0.0.3.43808 > 10.0.0.2.5002: UDP, length 1425
2026-05-28 03:03:53.386723 IP 10.0.0.3.43808 > 10.0.0.2.5002: UDP, length 1425
2026-05-28 03:03:53.386727 IP 10.0.0.3.43808 > 10.0.0.2.5002: UDP, length 1425
2026-05-28 03:03:53.386729 IP 10.0.0.3.43808 > 10.0.0.2.5002: UDP, length 1425
2026-05-28 03:03:53.386807 IP 10.0.0.2.5002 > 10.0.0.3.43808: UDP, length 25
2026-05-28 03:03:53.386926 IP 10.0.0.2.5002 > 10.0.0.3.43808: UDP, length 25
2026-05-28 03:03:53.386978 IP 10.0.0.2.5002 > 10.0.0.3.43808: UDP, length 25
2026-05-28 03:03:53.387024 IP 10.0.0.2.5002 > 10.0.0.3.43808: UDP, length 25
2026-05-28 03:03:53.399631 IP 10.0.0.3.43808 > 10.0.0.2.5002: UDP, length 1425
2026-05-28 03:03:53.399648 IP 10.0.0.3.43808 > 10.0.0.2.5002: UDP, length 1425
2026-05-28 03:03:53.399650 IP 10.0.0.3.43808 > 10.0.0.2.5002: UDP, length 1425
2026-05-28 03:03:53.399651 IP 10.0.0.3.43808 > 10.0.0.2.5002: UDP, length 1425
2026-05-28 03:03:53.399734 IP 10.0.0.2.5002 > 10.0.0.3.43808: UDP, length 25
2026-05-28 03:03:53.399826 IP 10.0.0.2.5002 > 10.0.0.3.43808: UDP, length 25
2026-05-28 03:03:53.399857 IP 10.0.0.2.5002 > 10.0.0.3.43808: UDP, length 25
2026-05-28 03:03:53.399913 IP 10.0.0.2.5002 > 10.0.0.3.43808: UDP, length 25
2026-05-28 03:03:53.412637 IP 10.0.0.3.43808 > 10.0.0.2.5002: UDP, length 1425
2026-05-28 03:03:53.412650 IP 10.0.0.3.43808 > 10.0.0.2.5002: UDP, length 1425
2026-05-28 03:03:53.412652 IP 10.0.0.3.43808 > 10.0.0.2.5002: UDP, length 1425
2026-05-28 03:03:53.412653 IP 10.0.0.3.43808 > 10.0.0.2.5002: UDP, length 1425
2026-05-28 03:03:53.412739 IP 10.0.0.2.5002 > 10.0.0.3.43808: UDP, length 25
2026-05-28 03:03:53.412802 IP 10.0.0.2.5002 > 10.0.0.3.43808: UDP, length 25
2026-05-28 03:03:53.412826 IP 10.0.0.2.5002 > 10.0.0.3.43808: UDP, length 25
2026-05-28 03:03:53.412857 IP 10.0.0.2.5002 > 10.0.0.3.43808: UDP, length 25
2026-05-28 03:03:53.423750 IP 10.0.0.3.43808 > 10.0.0.2.5002: UDP, length 1425
2026-05-28 03:03:53.423791 IP 10.0.0.3.43808 > 10.0.0.2.5002: UDP, length 1425
2026-05-28 03:03:53.423800 IP 10.0.0.3.43808 > 10.0.0.2.5002: UDP, length 1425
2026-05-28 03:03:53.423802 IP 10.0.0.3.43808 > 10.0.0.2.5002: UDP, length 1425
2026-05-28 03:03:53.424029 IP 10.0.0.2.5002 > 10.0.0.3.43808: UDP, length 25
2026-05-28 03:03:53.424314 IP 10.0.0.2.5002 > 10.0.0.3.43808: UDP, length 25
2026-05-28 03:03:53.424483 IP 10.0.0.2.5002 > 10.0.0.3.43808: UDP, length 25
2026-05-28 03:03:53.424666 IP 10.0.0.2.5002 > 10.0.0.3.43808: UDP, length 25
2026-05-28 03:03:53.435700 IP 10.0.0.3.43808 > 10.0.0.2.5002: UDP, length 1425
2026-05-28 03:03:53.435732 IP 10.0.0.3.43808 > 10.0.0.2.5002: UDP, length 1425
2026-05-28 03:03:53.435739 IP 10.0.0.3.43808 > 10.0.0.2.5002: UDP, length 1425
2026-05-28 03:03:53.435741 IP 10.0.0.3.43808 > 10.0.0.2.5002: UDP, length 1425
2026-05-28 03:03:53.435921 IP 10.0.0.2.5002 > 10.0.0.3.43808: UDP, length 25
2026-05-28 03:03:53.436101 IP 10.0.0.2.5002 > 10.0.0.3.43808: UDP, length 25
2026-05-28 03:03:53.436149 IP 10.0.0.2.5002 > 10.0.0.3.43808: UDP, length 25
2026-05-28 03:03:53.436195 IP 10.0.0.2.5002 > 10.0.0.3.43808: UDP, length 25
2026-05-28 03:03:53.447880 IP 10.0.0.3.43808 > 10.0.0.2.5002: UDP, length 1425
2026-05-28 03:03:53.447894 IP 10.0.0.3.43808 > 10.0.0.2.5002: UDP, length 1425
2026-05-28 03:03:53.447896 IP 10.0.0.3.43808 > 10.0.0.2.5002: UDP, length 1425
2026-05-28 03:03:53.447897 IP 10.0.0.3.43808 > 10.0.0.2.5002: UDP, length 1425
2026-05-28 03:03:53.447963 IP 10.0.0.2.5002 > 10.0.0.3.43808: UDP, length 25
2026-05-28 03:03:53.448081 IP 10.0.0.2.5002 > 10.0.0.3.43808: UDP, length 25
2026-05-28 03:03:53.448120 IP 10.0.0.2.5002 > 10.0.0.3.43808: UDP, length 25
2026-05-28 03:03:53.448168 IP 10.0.0.2.5002 > 10.0.0.3.43808: UDP, length 25
2026-05-28 03:03:53.461019 IP 10.0.0.3.43808 > 10.0.0.2.5002: UDP, length 1425
2026-05-28 03:03:53.461062 IP 10.0.0.3.43808 > 10.0.0.2.5002: UDP, length 1425
2026-05-28 03:03:53.461067 IP 10.0.0.3.43808 > 10.0.0.2.5002: UDP, length 1425
2026-05-28 03:03:53.461068 IP 10.0.0.3.43808 > 10.0.0.2.5002: UDP, length 1425
2026-05-28 03:03:53.461267 IP 10.0.0.2.5002 > 10.0.0.3.43808: UDP, length 25
2026-05-28 03:03:53.461434 IP 10.0.0.2.5002 > 10.0.0.3.43808: UDP, length 25
2026-05-28 03:03:53.461459 IP 10.0.0.2.5002 > 10.0.0.3.43808: UDP, length 25
2026-05-28 03:03:53.461506 IP 10.0.0.2.5002 > 10.0.0.3.43808: UDP, length 25
2026-05-28 03:03:53.473648 IP 10.0.0.3.43808 > 10.0.0.2.5002: UDP, length 1425
2026-05-28 03:03:53.473660 IP 10.0.0.3.43808 > 10.0.0.2.5002: UDP, length 1425
2026-05-28 03:03:53.473663 IP 10.0.0.3.43808 > 10.0.0.2.5002: UDP, length 1425
2026-05-28 03:03:53.473665 IP 10.0.0.3.43808 > 10.0.0.2.5002: UDP, length 1425
2026-05-28 03:03:53.473738 IP 10.0.0.2.5002 > 10.0.0.3.43808: UDP, length 25
2026-05-28 03:03:53.473867 IP 10.0.0.2.5002 > 10.0.0.3.43808: UDP, length 25
2026-05-28 03:03:53.473917 IP 10.0.0.2.5002 > 10.0.0.3.43808: UDP, length 25
2026-05-28 03:03:53.473956 IP 10.0.0.2.5002 > 10.0.0.3.43808: UDP, length 25
